abstract,lead_paragraph,headline,headline_main,abstract_polarity,abstract_subjectivity,lead_paragraph_polarity,lead_paragraph_subjectivity,headline_polarity,headline_subjectivity,year,month
"President Obama labeled the Boston blasts a terrorist attack for the first time, but he said officials did not know whether it was the work of foreign or domestic groups or individuals.","WASHINGTON — When President Obama went before cameras at the White House on Tuesday, he said he knew nothing more about who carried out the deadly bombings in Boston than he did the day before. But he knew enough to call them an “act of terrorism.”","{'main': 'Obama Calls Blasts an ‘Act of Terrorism’', 'kicker': None, 'content_kicker': None, 'print_headline': None, 'name': None, 'seo': None, 'sub': None}",Obama Calls Blasts an ‘Act of Terrorism’,0.041666666666666664,0.18611111111111112,0.075,0.35,0.0,0.0,2013,4
The raid at the naval base in Cuba followed weeks of tensions over a growing hunger strike that detainees’ lawyers say was provoked by a search of Korans in February.,"GUANTÁNAMO BAY NAVAL BASE, Cuba — Military officials on Tuesday described prison conditions here in the weeks leading up to a raid Saturday as chaotic, with detainees breaking rules with impunity, blocking cameras and windows, shouting at guards, splashing them with urine and poking sticks at them through the fencing. They said prisoners refused to go into their cells and shut their doors for a daily two-hour lockdown, and it was deemed too dangerous for guards to enter the common area to remove a troublemaker when many prisoners were freely roaming.","{'main': 'Officials Describe Chaos at Guantánamo in Weeks Before Raid on Prison', 'kicker': None, 'content_kicker': None, 'print_headline': 'Officials Describe Chaos at Guantánamo In Weeks That Preceded Raid on Prison', 'name': None, 'seo': None, 'sub': None}",Officials Describe Chaos at Guantánamo in Weeks Before Raid on Prison,-0.8,1.0,-0.1285714285714286,0.5428571428571428,0.0,0.0,2013,4
"Officials said they were still at the start of an inquiry on the attack at the Boston Marathon that killed three people and hurt more than 170, using what were likely kitchen pressure cookers set up to shoot shrapnel.","BOSTON — The explosives that killed three people and injured more than 170 during the Boston Marathon on Monday were most likely rudimentary devices made from ordinary kitchen pressure cookers, except they were rigged to shoot sharp bits of shrapnel into anyone within reach of their blast and maim them severely, law enforcement officials said Tuesday.","{'main': 'Boston Bombs Were Loaded to Maim', 'kicker': None, 'content_kicker': None, 'print_headline': 'Boston Bombs Were Loaded to Maim, Officials Say', 'name': None, 'seo': None, 'sub': None}",Boston Bombs Were Loaded to Maim,0.09999999999999999,0.5,0.07083333333333335,0.5416666666666666,0.0,0.0,2013,4
"George W. Bush has stayed out of the spotlight since leaving the White House, but he recently welcomed his first grandchild and, next week, he will dedicate his expansive presidential center.","DALLAS — For a former president, it does not get much better than this. Over the weekend, George W. Bush welcomed his first grandchild into the world. Next week he will welcome the arrival of his other baby, a 226,565-square-foot presidential center.","{'main': 'With Grandchild and Library, a New Chapter for Bush', 'kicker': None, 'content_kicker': None, 'print_headline': 'With Grandchild and Library, a New Chapter for Bush', 'name': None, 'seo': None, 'sub': None}","With Grandchild and Library, a New Chapter for Bush",0.03,0.13666666666666666,0.18928571428571428,0.3154761904761905,0.13636363636363635,0.45454545454545453,2013,4
Political news from today’s Times and a look at the latest happenings in Washington.,In Today’s Times,"{'main': 'The Early Word: Unveiled', 'kicker': 'The Caucus', 'content_kicker': None, 'print_headline': None, 'name': None, 'seo': None, 'sub': None}",The Early Word: Unveiled,0.25,0.5,0.0,0.0,0.1,0.3,2013,4
"In 2008, Barack Obama criticized President George W. Bush's anti-terrorism policies. Now criticism is directed at the Obama administration and its extensive use of drones to kill militants overseas.","WASHINGTON — As a candidate in 2008, Barack Obama was unsparing in his criticism of President George W. Bush’s anti-terrorism policies. He assailed torture and the infamous detention center at Guantánamo Bay, the lack of transparency and congressional oversight, the dubious legal framework and the blowback that was spawning more terrorists and diminishing U.S. standing in the world.","{'main': 'Killing Terrorists, Creating More', 'kicker': 'Letter From Washington', 'content_kicker': None, 'print_headline': 'Killing Terrorists, Creating More', 'name': None, 'seo': None, 'sub': None}","Killing Terrorists, Creating More",0.0,0.3333333333333333,0.02500000000000001,0.45,0.5,0.5,2013,4
"There has been a gradual decline in the number of terrorist attacks since the 1970s, according to the Global Terrorism Database.","WASHINGTON — The bombing of the Boston Marathon on Monday was the end of more than a decade in which the United States experienced strikingly few terrorist attacks, in part because of the far more aggressive law enforcement tactics that arose after the Sept. 11, 2001, attacks.","{'main': 'Bombings End Decade of Strikingly Few Successful Terrorism Attacks in U.S.', 'kicker': None, 'content_kicker': None, 'print_headline': 'Blasts End A Decade Of Terrorism On the Wane', 'name': None, 'seo': None, 'sub': None}",Bombings End Decade of Strikingly Few Successful Terrorism Attacks in U.S.,0.0,0.0,0.34,0.6,0.275,0.525,2013,4
"The family of Jeff Bauman, who lost his legs in the bombings, learned of his fate from an image of the bloodied young man being tended to by a man in a cowboy hat.","BOSTON — When Jeff Bauman woke up in a hospital bed on Tuesday, an air tube was down his throat, both of his legs had been amputated at the knee, and his father was by his side. He tried to talk, but he could not.","{'main': 'In Grisly Image, a Father Sees His Son', 'kicker': None, 'content_kicker': None, 'print_headline': 'In Signal Image From Boston Bombing, a Father Sees His Son', 'name': None, 'seo': None, 'sub': None}","In Grisly Image, a Father Sees His Son",0.1,0.4,-0.15555555555555556,0.2888888888888889,0.0,0.0,2013,4
The major issue for many students is that subjects that often appear practical may turn out to be completely impractical in the context of what students typically want and ought to accomplish in college.,"Philip A. Bean is an associate dean and dean of academic affairs at Haverford College, a private, liberal arts institution near Philadelphia.","{'main': 'Choosing a Practical Major', 'kicker': 'The Choice', 'content_kicker': None, 'print_headline': None, 'name': None, 'seo': None, 'sub': None}",Choosing a Practical Major,0.12395833333333334,0.475,0.03333333333333333,0.25833333333333336,0.0625,0.5,2013,4
One approach designed to entice lawmakers representing large rural areas would exempt residents who live hundreds of miles from a gun dealer from background checks.,"WASHINGTON — Short of votes for their compromise gun legislation, Senators Joe Manchin III, Democrat of West Virginia, and Patrick J. Toomey, Republican of Pennsylvania, on Monday considered changes to their plan to expand background checks for gun buyers as they scrambled to win needed converts.","{'main': 'Senators, Seeking Support, Weigh Revisions to Background Check Bill', 'kicker': None, 'content_kicker': None, 'print_headline': 'Senators, Seeking Support, Weigh Revisions to Background Check Bill', 'name': None, 'seo': None, 'sub': None}","Senators, Seeking Support, Weigh Revisions to Background Check Bill",0.11688311688311688,0.30952380952380953,0.4,0.35,0.0,0.0,2013,4
"Following accusations that the case was being ignored by the national news media, reporters descended Monday on Philadelphia, where Dr. Kermit Gosnell was on trial.","PHILADELPHIA — Through four weeks, prosecutors have laid out evidence against Dr. Kermit Gosnell, a Philadelphia abortion provider on trial on charges of killing seven viable fetuses by “snipping” their necks with scissors and of causing the death of a pregnant 41-year-old woman during a procedure. ","{'main': 'Online Furor Draws Press to Abortion Doctor’s Trial', 'kicker': None, 'content_kicker': None, 'print_headline': 'Online Furor Draws Press to Abortion Doctor’s Trial', 'name': None, 'seo': None, 'sub': None}",Online Furor Draws Press to Abortion Doctor’s Trial,0.0,0.1,0.3333333333333333,0.5,0.0,0.0,2013,4
An envelope addressed to Senator Roger Wicker of Mississippi showed positive results for the toxin in tests at a mail facility in Washington. It was sent to the F.B.I. for more analysis.,"WASHINGTON — A letter sent to a Mississippi senator tested positive for the poison ricin, federal authorities revealed Tuesday, adding to security concerns in the Capitol after the Boston Marathon bombing.","{'main': 'Letter Mailed to Senator Tests Positive for Ricin', 'kicker': None, 'content_kicker': None, 'print_headline': 'Toxic Ricin Is Detected in Letter Mailed to Senator', 'name': None, 'seo': None, 'sub': None}",Letter Mailed to Senator Tests Positive for Ricin,0.36363636363636365,0.5227272727272727,0.22727272727272727,0.5454545454545454,0.22727272727272727,0.5454545454545454,2013,4
"Supporters of abortion rights called the law, banning most abortions at the 12th week of pregnancy, a “violation of over 40 years of settled United States Supreme Court precedent.”","Supporters of abortion rights on Tuesday filed a challenge to the new Arkansas law banning most abortions at the 12th week of pregnancy, calling it a “violation of over 40 years of settled United States Supreme Court precedent” and a threat to “the rights, liberty and well-being of Arkansas women and their families.”","{'main': 'Suit Seeks to Block Arkansas Abortion Law', 'kicker': None, 'content_kicker': None, 'print_headline': 'Arkansas: Challenge to New Law Curbing Abortion', 'name': None, 'seo': None, 'sub': None}",Suit Seeks to Block Arkansas Abortion Law,0.5,0.5,0.3181818181818182,0.4772727272727273,0.0,0.0,2013,4
"The ruling is not final, but it did keep the law from going into effect while a decision on its constitutionality is made, keeping Mississippi, for now, from becoming the first state without a clinic.",NEW ORLEANS — A federal judge in Mississippi on Monday blocked part of a state law that would have forced the closing of the state’s only abortion clinic. ,"{'main': 'Judge Prevents Closing of Mississippi’s Sole Abortion Clinic', 'kicker': None, 'content_kicker': None, 'print_headline': 'Judge Prevents Closing of Mississippi’s Sole Abortion Clinic', 'name': None, 'seo': None, 'sub': None}",Judge Prevents Closing of Mississippi’s Sole Abortion Clinic,0.2333333333333333,0.7277777777777779,-0.054545454545454564,0.5515151515151515,0.0,0.25,2013,4
"Legislation by a bipartisan group of senators, set for introduction on Tuesday, would demand tough border controls but provide a 13-year path to citizenship for certain illegal immigrants.",WASHINGTON — The introduction of sweeping immigration legislation on Tuesday is likely to ignite a months-long battle between those who want citizenship for the nation’s 11 million illegal immigrants and opponents who view such an approach as amnesty.,"{'main': 'Immigration Overhaul Proposal Is Likely to Ignite Fierce Debate', 'kicker': None, 'content_kicker': None, 'print_headline': 'Immigration Overhaul Proposal Is Likely to Ignite Fierce Debate', 'name': None, 'seo': None, 'sub': None}",Immigration Overhaul Proposal Is Likely to Ignite Fierce Debate,-0.22486772486772488,0.6349206349206349,-0.16666666666666666,0.6666666666666666,0.0,1.0,2013,4
The decision severely limited the sweep of a 1789 law that had been used to address human rights abuses abroad.,WASHINGTON — The Supreme Court ruled on Wednesday that Nigerian plaintiffs who said foreign oil companies had been complicit in violating their human rights may not sue in American courts. The decision limited the sweep of a 1789 law that had been used to address human rights abuses abroad.,"{'main': 'Justices Bar Nigerian Human Rights Case From U.S. Courts ', 'kicker': None, 'content_kicker': None, 'print_headline': 'Justices Bar Nigerian Human Rights Case From U.S. Courts', 'name': None, 'seo': None, 'sub': None}",Justices Bar Nigerian Human Rights Case From U.S. Courts ,-0.03571428571428571,0.12142857142857143,-0.039285714285714285,0.09357142857142857,0.0,0.1,2013,4
"As the Senate prepares to vote on a series of gun measures Wednesday afternoon, recent polls show a slim majority of Americans place a higher priority on enacting new gun laws to reduce gun violence over protecting the right to own guns.","As the Senate prepares to vote on a series of gun measures Wednesday afternoon, recent polls show a slim majority of Americans place a higher priority on enacting new gun laws to reduce gun violence over protecting the right to own guns. Yet, support for toughening up gun laws has dropped since the Newtown, Conn., school shooting in mid-December. ","{'main': 'Public Opinion Stands Behind Democrats on Gun Measures', 'kicker': 'The Caucus', 'content_kicker': None, 'print_headline': None, 'name': None, 'seo': None, 'sub': None}",Public Opinion Stands Behind Democrats on Gun Measures,0.2544155844155844,0.548051948051948,0.2544155844155844,0.548051948051948,-0.2,0.3833333333333333,2013,4
The National Republican Congressional Committee backed away from the former South Carolina governor after court documents alleged that he trespassed at his ex-wife’s house.,"National Republicans on Wednesday backed away from Mark Sanford, the former South Carolina governor who is now running for Congress, after court documents alleged that he trespassed at his ex-wife’s house.","{'main': 'Mark Sanford Won’t Get Money From G.O.P. for House Bid', 'kicker': 'The Caucus', 'content_kicker': None, 'print_headline': 'National G.O.P. Won’t Support Sanford', 'name': None, 'seo': None, 'sub': None}",Mark Sanford Won’t Get Money From G.O.P. for House Bid,-0.05,0.05,-0.05,0.05,0.0,0.0,2013,4
"The fact that alcohol dissipates from the bloodstream over time does not by itself allow the police to take blood over objections, the Supreme Court ruled.","WASHINGTON — The fact that alcohol dissipates from the bloodstream over time does not by itself give the police the right to draw blood without a warrant in drunken-driving investigations, the Supreme Court ruled on Wednesday.","{'main': 'Court Says Police Need Warrant for Blood Test', 'kicker': None, 'content_kicker': None, 'print_headline': 'Court Says Police Need Warrant For Blood Test', 'name': None, 'seo': None, 'sub': None}",Court Says Police Need Warrant for Blood Test,0.0,0.0,0.2857142857142857,0.5357142857142857,0.0,0.0,2013,4
"In addition to Martin Richard and Krystle Campbell, a female graduate student from China was identified as the third spectator killed in the marathon blasts.","BOSTON — Martin Richard and Krystle Campbell, two of three people killed Monday at the Boston Marathon, shared something in common with most of those injured by the blasts. They were there to watch others. They were not supposed to be the subjects of a newspaper story.","{'main': 'Victims, Ages 8 and 29, Remembered for Kindness and Laughter', 'kicker': None, 'content_kicker': None, 'print_headline': 'Victims, Ages 8 and 29, Remembered for Kindness and Laughter', 'name': None, 'seo': None, 'sub': None}","Victims, Ages 8 and 29, Remembered for Kindness and Laughter",-0.06666666666666667,0.05555555555555555,0.0,0.3333333333333333,0.0,0.0,2013,4
"A wrenching national search for solutions to the violence that left 20 children dead in Newtown, Conn., all but ended after the Senate defeated several gun-related measures.","WASHINGTON — A wrenching national search for solutions to the violence that left 20 children dead in Newtown, Conn., all but ended Wednesday after the Senate defeated several measures to expand gun control.","{'main': 'Senate Blocks Drive for Gun Control', 'kicker': None, 'content_kicker': None, 'print_headline': 'Gun Control Drive Blocked In Senate;\r\nObama, In Defeat, Sees ‘Shameful Day’', 'name': None, 'seo': None, 'sub': None}",Senate Blocks Drive for Gun Control,-0.06666666666666667,0.13333333333333333,-0.06666666666666667,0.13333333333333333,0.0,0.0,2013,4
"The free online engineering course could start a trend of directly advising high school students and their teachers on specific curriculums, motivated in part by the hypercompetitive college admissions process.","When Yaser S. Abu-Mostafa, a professor of electrical engineering and computer science at the California Institute of Technology, began promoting his online course on machine learning, one person he turned to was Caltech’s dean of admissions. Dr. Abu-Mostafa believed that prospective Caltech students would benefit from learning what it actually takes to be an engineer — something that high schools, on the whole, fail to teach adequately.","{'main': 'Brown University Creates Online Course for High School Students', 'kicker': 'The Choice', 'content_kicker': None, 'print_headline': None, 'name': None, 'seo': None, 'sub': None}",Brown University Creates Online Course for High School Students,0.165,0.46625000000000005,0.03866666666666666,0.33466666666666667,0.16,0.54,2013,4
It’s worth asking why Republicans have achieved success in state races at the same time that they’ve had difficulty in federal ones.,"One of the problems with the claim that the Republican Party is doomed to many years of failure is that it is having plenty of success now — at the state level. The G.O.P. controls 30 of the nation’s governorships, along with a majority of state legislatures.","{'main': 'In State Governments, Signs of a Healthier G.O.P.', 'kicker': 'FiveThirtyEight', 'content_kicker': None, 'print_headline': None, 'name': None, 'seo': None, 'sub': None}","In State Governments, Signs of a Healthier G.O.P.",0.19999999999999998,0.075,0.16111111111111112,0.26666666666666666,0.0,0.0,2013,4
A federal appeals court heard arguments over whether banning “conversion therapy” for minors is an infringement on free speech or a valid effort to prevent malpractice.,A federal appeals court in San Francisco heard arguments on Wednesday over whether a California law banning gay “conversion therapy” for minors is an unjustified infringement on free speech or a valid effort to prevent therapeutic malpractice. ,"{'main': ' Court Hears Gay ‘Conversion Therapy’ Arguments ', 'kicker': None, 'content_kicker': None, 'print_headline': 'Court Hears Gay ‘Conversion Therapy’ Arguments', 'name': None, 'seo': None, 'sub': None}", Court Hears Gay ‘Conversion Therapy’ Arguments ,0.4,0.8,0.4083333333333333,0.6916666666666667,0.4166666666666667,0.5833333333333334,2013,4
"Kim Lene Williams said her husband, a former justice of the peace, killed a district attorney, his wife and another prosecutor in Kaufman County.","KAUFMAN, Tex. — The mystery of who shot and killed two prosecutors this year clouded life in this rural county southeast of Dallas for more than two months, with investigators delving into possible leads that led to white-supremacist groups and Mexican drug cartels.","{'main': 'Disgraced Official’s Wife Accuses Him in Texas Killings', 'kicker': None, 'content_kicker': None, 'print_headline': 'Couple Held in the Killings Of Two Texas Prosecutors', 'name': None, 'seo': None, 'sub': None}",Disgraced Official’s Wife Accuses Him in Texas Killings,-0.1,0.0,0.06,0.3,0.0,0.0,2013,4
"Officials discovered firearms in a Seagoville, Tex., storage unit linked to a former justice of the peace who lost a legal fight with two prosecutors who were killed.","KAUFMAN, Tex. — The contents of a storage unit — and the former elected official who had an associate rent the shed for him — have become central to the investigation into the murder of two prosecutors here.","{'main': 'Stockpile of Guns Is Found in Texas Murder Inquiry', 'kicker': None, 'content_kicker': None, 'print_headline': 'Stockpile of Guns Is Found in Texas Murder Inquiry', 'name': None, 'seo': None, 'sub': None}",Stockpile of Guns Is Found in Texas Murder Inquiry,0.0,0.06666666666666667,0.0,0.125,0.0,0.0,2013,4
"In the first major break in the hunt for the Boston Marathon bomber, F.B.I. personnel found security video showing a man they believe may have played a role in planting explosives.","BOSTON — In the first major break in the hunt for the Boston Marathon bomber, F.B.I. personnel on Wednesday found security video clips that showed a man they believe may have played a role in planting the explosives that killed three people and injured more than 170 on Monday.","{'main': 'Suspicions in Boston Attack Turn to Man Seen in Videos', 'kicker': None, 'content_kicker': None, 'print_headline': 'Suspicions in Boston Attack Turn to Man Seen in Videos', 'name': None, 'seo': None, 'sub': None}",Suspicions in Boston Attack Turn to Man Seen in Videos,0.15625,0.41666666666666663,0.153125,0.3333333333333333,0.0,0.0,2013,4
"The practice, which colleges and universities consider an economic benefit, comes as a shock to students.","As part of an admissions practice that seems to be on the rise, many of this year’s admitted college applicants have learned that they must wait until spring 2014 to enroll, my colleague Ariel Kaminer reports:","{'main': 'More College Applicants Aren’t Welcome Until Second Semester', 'kicker': 'The Choice', 'content_kicker': None, 'print_headline': None, 'name': None, 'seo': None, 'sub': None}",More College Applicants Aren’t Welcome Until Second Semester,0.2,0.2,0.5,0.5,0.43333333333333335,0.4666666666666666,2013,4
"With the introduction of a sweeping immigration bill in Washington this week, immigrants across the country are paying close attention to how it might change their lives.","LOS ANGELES — In another era, Justino Mora might have been ashamed to talk about his mother coming across the border from Mexico illegally. But today, he calls her decision to immigrate more than a decade ago heroic.","{'main': 'With a Bill Now in the Senate, Immigrants Weigh the Possible Impact', 'kicker': None, 'content_kicker': None, 'print_headline': 'Immigrants Weigh Possible Impacts of Senate Bill', 'name': None, 'seo': None, 'sub': None}","With a Bill Now in the Senate, Immigrants Weigh the Possible Impact",0.0,0.0,0.2333333333333333,0.6333333333333333,0.0,1.0,2013,4
"Senator Max Baucus, Democrat of Montana, gave a “failing grade” to the administration’s public information effort about the health care law.",A routine Senate budget hearing turned into a public scolding as a prominent backer of the health care overhaul warned that a lack of public information could cause a “train wreck” as the law’s implementation moves forward. ,"{'main': 'Misconceptions Could Lead to Health Law ‘Train Wreck,’ Baucus Warns', 'kicker': 'The Caucus', 'content_kicker': None, 'print_headline': None, 'name': None, 'seo': None, 'sub': None}","Misconceptions Could Lead to Health Law ‘Train Wreck,’ Baucus Warns",0.0,0.06666666666666667,0.16666666666666666,0.37777777777777777,0.0,0.0,2013,4
Surgeons faced life-changing decisions as patients arrived with gruesome leg trauma.,"BOSTON — So many patients arrived at once, with variations of the same gruesome leg injuries. Shattered bones, shredded tissue, nails burrowed deep beneath the flesh. The decision had to be made, over and over, with little time to deliberate. Should this leg be amputated? What about this one?","{'main': 'Doctors Saved Lives, if Not Legs, in Boston', 'kicker': None, 'content_kicker': None, 'print_headline': 'Saving Lives, if Not Legs, With No Time to Fret', 'name': None, 'seo': None, 'sub': None}","Doctors Saved Lives, if Not Legs, in Boston",-1.0,1.0,-0.1375,0.505,0.0,0.0,2013,4
A Times examination found that unlicensed sellers advertise scores of weapons on free classified ads Web sites where people legally barred from gun ownership can buy them.,"The want ads posted by the anonymous buyer on Armslist.com, a sprawling free classified ads Web site for guns, telegraphed urgency.","{'main': 'Seeking Gun or Selling One, Web Is a Land of Few Rules', 'kicker': 'Bearing Arms', 'content_kicker': None, 'print_headline': 'Seeking Gun or Selling One, Web Is a Land of Few Rules', 'name': None, 'seo': None, 'sub': None}","Seeking Gun or Selling One, Web Is a Land of Few Rules",0.30000000000000004,0.5,0.4,0.8,-0.2,0.1,2013,4
"The Senate on Wednesday rejected a series of gun measures that would determine the shape of legislation inspired by the shootings in Newtown, Conn.","The Senate on Wednesday voted on a series of gun measures that would determine the shape of legislation inspired by the shootings in Newtown, Conn. Among the amendments rejected by the Senate were a measure that would expand background checks for gun purchases another that would reinstate ban on assault weapons.","{'main': 'Highlights: Senate Debates Gun Measures', 'kicker': 'The Caucus', 'content_kicker': None, 'print_headline': None, 'name': None, 'seo': None, 'sub': None}",Highlights: Senate Debates Gun Measures,0.0,0.0,0.0,0.0,0.0,0.0,2013,4
Political news from today’s Times and a look at the latest happenings in Washington.,In Today’s Times,"{'main': 'The Early Word: Scare', 'kicker': 'The Caucus', 'content_kicker': None, 'print_headline': None, 'name': None, 'seo': None, 'sub': None}",The Early Word: Scare,0.25,0.5,0.0,0.0,0.1,0.3,2013,4
