abstract,lead_paragraph,headline,headline_main,abstract_polarity,abstract_subjectivity,lead_paragraph_polarity,lead_paragraph_subjectivity,headline_polarity,headline_subjectivity,year,month
We’ll be following the returns as they come in tonight.," 1:34 a.m. | The Wrap: After a grueling and unexpectedly dramatic night, Senator Clinton at last pulls out a win in Indiana, but by a bare 22,000 votes, or 50.9 percent to 49.1 percent. But her “win” almost doesn’t matter. That Mr. Obama came so close is bad news for her.","{'main': 'Live Blogging the Indiana-North Carolina Primaries', 'kicker': 'The Caucus', 'content_kicker': None, 'print_headline': None, 'name': None, 'seo': None, 'sub': None}",Live Blogging the Indiana-North Carolina Primaries,0.0,0.1,0.08611111111111115,0.37222222222222223,0.13636363636363635,0.5,2008,5
"Rudolph W. Giuliani, was circumspect when asked the question Wednesday morning, but allowed that he admired Senator Clinton’s persistence.","Should Hillary Rodham Clinton drop out of the presidential race? Her onetime nemesis, Rudolph W. Giuliani, was circumspect when asked the question Wednesday morning, but allowed that he admired Senator Clinton’s persistence.","{'main': 'Giuliani Weighs In on Democrats’ Battle, and Kiev Mayoral Race', 'kicker': 'The Caucus', 'content_kicker': None, 'print_headline': None, 'name': None, 'seo': None, 'sub': None}","Giuliani Weighs In on Democrats’ Battle, and Kiev Mayoral Race",0.0,0.0,0.0,0.0,0.0,0.0,2008,5
Senator Barack Obama received new ammunition as he sought to persuade Democratic leaders to coalesce around him.,"Senator Barack Obama won a commanding victory in the North Carolina primary on Tuesday and lost narrowly to Senator Hillary Rodham Clinton in Indiana, an outcome that injected a boost of momentum to Mr. Obama’s candidacy as the Democratic nominating contest entered its final month.","{'main': 'Obama Wins North Carolina Decisively; Clinton Takes Indiana by Slim Margin', 'kicker': None, 'content_kicker': None, 'print_headline': 'Obama Wins Easily in North Carolina, and Clinton Barely in Indiana', 'name': None, 'seo': None, 'sub': None}",Obama Wins North Carolina Decisively; Clinton Takes Indiana by Slim Margin,0.13636363636363635,0.45454545454545453,0.06666666666666667,0.6333333333333333,0.3,0.2,2008,5
"After a big loss in North Carolina and a narrow win in Indiana, bloggers debate the merits of Hillary Rodham Clinton continuing her campaign for president.","Hillary Rodham Clinton pressed on with her presidential campaign Wednesday, the day after squeaking out a win in the Indiana primary and losing badly to Barack Obama in North Carolina. ","{'main': 'Blogtalk: Should She Stay?', 'kicker': 'The Caucus', 'content_kicker': None, 'print_headline': None, 'name': None, 'seo': None, 'sub': None}",Blogtalk: Should She Stay?,0.20000000000000004,0.3,0.16666666666666677,0.5222222222222223,0.0,0.0,2008,5
"These endorsements brings the total number of superdelegates to endorse Barack Obama to 261, according to the campaign’s tally. He is 170 delegates away from securing the Democratic nomination.","From this point forward in the Democratic presidential nominating contest, the fight between Senators Barack Obama and Hillary Rodham Clinton will be boiled down to a day-by-day accounting of superdelegates. ","{'main': 'Obama Announces 3 Superdelegates', 'kicker': 'The Caucus', 'content_kicker': None, 'print_headline': None, 'name': None, 'seo': None, 'sub': None}",Obama Announces 3 Superdelegates,0.0,0.75,-0.15555555555555556,0.2888888888888889,0.0,0.0,2008,5
"CBS News projected that Senator Hillary Rodham Clinton would win in Indiana at 8:09 p.m., and then hung on for a nail-biter of a night.","At 8:09 p.m. on Tuesday, Katie Couric broke into the procedural crime drama “NCIS” to tell her viewers: “A split decision tonight in the latest primary showdown: Hillary Clinton needed to win Indiana; CBS News estimates she did. Meanwhile, we’re projecting Barack Obama the winner in North Carolina.”","{'main': 'After Making an Early Call, CBS Keeps a Lonely Stand', 'kicker': None, 'content_kicker': None, 'print_headline': 'After Making an Early Call, CBS Keeps a Lonely Stand', 'name': None, 'seo': None, 'sub': None}","After Making an Early Call, CBS Keeps a Lonely Stand",0.8,0.4,0.5666666666666668,0.6,1.3877787807814457e-17,0.5,2008,5
"On the day after, the senator’s strategists and supporters defer a bit to any exit strategy his Democratic rival may choose.","The conference call has become the weapon of art for the post-primary day, an easy way of allowing a candidate’s surrogates to spin and push and slice and dice without directly implicating the candidate in the attacks.","{'main': 'The Obama Camp Dials It Forward', 'kicker': 'The Caucus', 'content_kicker': None, 'print_headline': None, 'name': None, 'seo': None, 'sub': None}",The Obama Camp Dials It Forward,0.0,0.0,0.26666666666666666,0.6166666666666667,0.0,0.0,2008,5
"In what was titled “My Plea to Republicans,” Newt Gingrich called on them to force the leadership into devising a new approach to the coming elections.","WASHINGTON  Newt Gingrich, the man who engineered the Republican takeover of the House in 1994, warned his fellow Republicans on Tuesday that they faced disastrous losses in November without a quick change in political course.","{'main': 'Gingrich Warns G.O.P. Swift Change Is Needed', 'kicker': None, 'content_kicker': None, 'print_headline': 'Gingrich Warns G.O.P. Swift Change Is Needed', 'name': None, 'seo': None, 'sub': None}",Gingrich Warns G.O.P. Swift Change Is Needed,0.13636363636363635,0.45454545454545453,-0.12222222222222222,0.46666666666666673,0.0,0.0,2008,5
"The Republican candidate holds a town hall meeting in Michigan, where he’s confronted with quotes from a Senate colleague.","ROCHESTER, Mich.—Senator John McCain got hit with a fusillade of tough questions at a town-hall-style meeting in Michigan this morning, including queries about whether his temper – the candidate acknowledged he gets angry — would pose a problem in the White House.","{'main': 'McCain Fields Questions on His Temper', 'kicker': 'The Caucus', 'content_kicker': None, 'print_headline': None, 'name': None, 'seo': None, 'sub': None}",McCain Fields Questions on His Temper,0.0,0.0,-0.2962962962962963,0.6111111111111112,0.0,0.0,2008,5
"The limited progress seen in test results released Tuesday is an improvement over stagnant conditions before Hurricane Katrina struck in 2005, officials said.","NEW ORLEANS  A broad education overhaul under way here has produced improvement in test scores, results released Tuesday showed, though many students are still struggling. ","{'main': 'Changes at New Orleans Schools Bring Gains in Test Scores', 'kicker': None, 'content_kicker': None, 'print_headline': 'Changes at New Orleans Schools Bring Gains in Test Scores', 'name': None, 'seo': None, 'sub': None}",Changes at New Orleans Schools Bring Gains in Test Scores,-0.07142857142857142,0.14285714285714285,0.23295454545454544,0.42234848484848486,0.13636363636363635,0.45454545454545453,2008,5
A look at the popular vote and total delegate count following Tuesday’s contests in North Carolina and Indiana.,POPULAR VOTE,"{'main': 'By the Numbers', 'kicker': 'The Caucus', 'content_kicker': None, 'print_headline': None, 'name': None, 'seo': None, 'sub': None}",By the Numbers,0.19999999999999998,0.5833333333333334,0.6,0.9,0.0,0.0,2008,5
"An undercover operation in San Diego netted more than $100,000 worth of drugs and several weapons.","SAN DIEGO  Seventy-five students at San Diego State University have been arrested on drug and weapons charges in an undercover operation that grew out of a student’s death from a cocaine overdose last year, law enforcement authorities said on Tuesday. ","{'main': '75 Students Arrested in Drug Raid', 'kicker': None, 'content_kicker': None, 'print_headline': '75 College Students Arrested In San Diego Drug Raid', 'name': None, 'seo': None, 'sub': None}",75 Students Arrested in Drug Raid,0.26666666666666666,0.19999999999999998,0.0,0.06666666666666667,0.0,0.0,2008,5
"The mayor of San Francisco wants to make the recycling of cans, bottles, paper, yard waste and food scraps mandatory instead of voluntary, on the pain of having garbage pickups suspended.","SAN FRANCISCO  Mayor Gavin Newsom is competitive about many things, garbage included. When the city found out a few weeks ago that it was keeping 70 percent of its disposable waste out of local landfills, he embraced the statistic the way other mayors embrace winning sports teams, improved test scores or declining crime rates.","{'main': 'A City Committed to Recycling Is Ready for More', 'kicker': None, 'content_kicker': None, 'print_headline': 'A City Committed to Recycling Is Ready for More', 'name': None, 'seo': None, 'sub': None}",A City Committed to Recycling Is Ready for More,0.0,0.05,0.07916666666666666,0.28750000000000003,0.35,0.5,2008,5
"Senator John McCain vowed to appoint only judges he called strictly faithful to the Constitution, an issue of enormous importance to conservatives.","WINSTON-SALEM, N.C.  Senator John McCain reached out to conservatives on Tuesday by vowing to appoint judges he characterized as strictly faithful to the Constitution and who did not engage in what Mr. McCain condemned as “the common and systemic abuse of our federal courts.”","{'main': 'McCain Assures Conservatives of His Stance on Judges', 'kicker': None, 'content_kicker': None, 'print_headline': 'McCain Assures Conservatives of His Stance on Judges', 'name': None, 'seo': None, 'sub': None}",McCain Assures Conservatives of His Stance on Judges,0.0,0.95,-0.3,0.5,0.0,0.0,2008,5
"Eighteen months after scandals helped Democrats break a Republican monopoly on top state officers, Attorney General Marc Dann admitted Friday to having an affair with a member of his staff.","CINCINNATI  Eighteen months after scandals helped Democrats in Ohio break a Republican monopoly on top state offices, a Democratic official has found himself enmeshed in one of his own. ","{'main': 'After Promise of Reform, Ohio Democrats Face Test', 'kicker': None, 'content_kicker': None, 'print_headline': 'After Promise of Reform, Ohio Democrats Face Test', 'name': None, 'seo': None, 'sub': None}","After Promise of Reform, Ohio Democrats Face Test",0.275,0.5,0.55,0.75,0.0,0.0,2008,5
The attack ads reached a crescendo the likes of which had not yet been seen in an already hard-hitting race.,"In these closing hours of the North Carolina and Indiana primaries, voters in the two states have been witness to a cacophony of attack ads the likes of which had not yet been seen in this protracted and already hard-hitting Democratic race.","{'main': 'Flood of Attack Ads on Final Day', 'kicker': None, 'content_kicker': None, 'print_headline': 'In Closing Hours, Attack Ads Flood Indiana and N. Carolina', 'name': None, 'seo': None, 'sub': None}",Flood of Attack Ads on Final Day,0.0,0.0,0.0,0.0,0.0,1.0,2008,5
"All eyes were on Lake County in far northwest Indiana, where the fight over the primary had been increasingly tense for weeks.","Early this morning, all eyes were on Lake County in far northwest Indiana, which is, in essence, a suburb of Chicago, Senator Barack Obama’s hometown. Results from the county, one of the state’s most populous with 494,000 people, were dribbling in late into the night. Results there tightened margin between Senator Hillary Rodham Clinton and Senator Obama, raising the specter of a possible recount in the state. ","{'main': 'Results From an Indiana County Kept Democrats Waiting', 'kicker': None, 'content_kicker': None, 'print_headline': 'Results From an Indiana County Keep Democrats Waiting', 'name': None, 'seo': None, 'sub': None}",Results From an Indiana County Kept Democrats Waiting,0.05555555555555556,0.6666666666666666,0.07999999999999999,0.6799999999999999,0.0,0.0,2008,5
"Hillary Rodham Clinton struck a publicly defiant posture, while some of her advisers acknowledged privately that they remained unsure about the future of her candidacy.",Senator Hillary Rodham Clinton struck a publicly defiant posture on Wednesday about continuing her presidential bid despite waning support from Democratic officials and donors. Some of her advisers acknowledged privately that they remained unsure about the future of her candidacy.,"{'main': 'Support for Clinton Wanes as Obama Sees Finish Line', 'kicker': None, 'content_kicker': None, 'print_headline': 'As Support Fades, Clinton Focuses on Next Contest', 'name': None, 'seo': None, 'sub': None}",Support for Clinton Wanes as Obama Sees Finish Line,0.0,0.18888888888888888,0.0,0.18888888888888888,0.0,0.0,2008,5
Barack Obama’s team thinks he’ll have the delegates needed to claim the nomination by May 20. Hillary Rodham Clinton says “not so fast.”,We’ve heard this before — Feb. 5 will end the race. Ohio. Texas. Pennsylvania. Right. ,"{'main': 'The Early Word: The Clinton Watch', 'kicker': 'The Caucus', 'content_kicker': None, 'print_headline': None, 'name': None, 'seo': None, 'sub': None}",The Early Word: The Clinton Watch,0.2,0.6,0.2857142857142857,0.5357142857142857,0.1,0.3,2008,5
The House Speaker deflects questions about additional pushes by mega-Hollywood donors to let Senator Hillary Rodham Clinton keep on going.,"The House speaker, Nancy Pelosi, would not disclose today the details of a phone conversation she had with the movie mogul Harvey Weinstein, who CNN has been reporting pressured her about Senator Hillary Rodham Clinton’s candidacy a few weeks ago.","{'main': 'Pelosi Pressured?', 'kicker': 'The Caucus', 'content_kicker': None, 'print_headline': None, 'name': None, 'seo': None, 'sub': None}",Pelosi Pressured?,0.0,0.0,-0.2,0.1,0.0,0.0,2008,5
"Despite its retro charm, a mural painted on the side of a barn has come under fire in a state determined to keep its landscape free of commercial intrusion.","BELLOWS FALLS, Vt.  It was meant to be a throwback to the days of romantic Sunday drives  a mural painted on the side of a red barn urging passing drivers to “See Bellows Falls,” a town whose Main Street conjures up bygone days.","{'main': 'Mural Tests Vermont Law That Forbids Billboards', 'kicker': None, 'content_kicker': None, 'print_headline': 'Mural Tests Vermont Law That Forbids Billboards', 'name': None, 'seo': None, 'sub': None}",Mural Tests Vermont Law That Forbids Billboards,0.2,0.4,0.05555555555555555,0.27777777777777773,0.0,0.0,2008,5
A look at some of the photos that voters have submitted over the past months.,"The results keep coming in. Since we began asking for your photos back in February, hundreds of readers from San Diego to Strasbourg, Jakarta to Jersey City, have submitted images to the Polling Place Photo Project, our joint effort with the AIGA, the national association for design. The Polling Place Photo Project was created in 2006 by William Drenttel and AIGA during the midterm elections.The photos range from the quirky to the mundane – a bevy of ballot boxes, curtains, and levers – representing the far-flung corners of the nation. Often the images stray yards, perhaps miles, from the polling sites themselves, spilling out onto streets, walkways, and even cemeteries. Together they form a “voter-generated” portrait of the election season.","{'main': 'Your Photos Here', 'kicker': 'The Caucus', 'content_kicker': None, 'print_headline': None, 'name': None, 'seo': None, 'sub': None}",Your Photos Here,-0.25,0.25,-0.05555555555555555,0.3888888888888889,0.0,0.0,2008,5
"Interviewed by NBC’s Brian Williams, Barack Obama indicated that May 20, the day of primaries in Oregon and Kentucky, could be the day he claims the nomination.",Video,"{'main': 'Obama: I’m Not the Nominee Yet', 'kicker': 'The Caucus', 'content_kicker': None, 'print_headline': None, 'name': None, 'seo': None, 'sub': None}",Obama: I’m Not the Nominee Yet,0.0,0.0,0.0,0.0,0.0,0.0,2008,5
"The Democratic candidates surprises some with a visit to the floor of the House, a place awash in superdelegates.","In the great hunt for superdelegates, there is no better place to look than the floor of the House, and Senator Barack Obama dived right into a sea of them on Thursday morning, shaking hands, clapping backs, doling out hugs and even doing a little curtsy before Representative John M. Spratt Jr. of South Carolina, the chairman of the Budget Committee.","{'main': 'Obama Works the House', 'kicker': 'The Caucus', 'content_kicker': None, 'print_headline': None, 'name': None, 'seo': None, 'sub': None}",Obama Works the House,0.0,0.0,0.16205357142857144,0.5714285714285714,0.0,0.0,2008,5
"The Clinton era may be coming to an end, presenting the party with a potentially wrenching transition and a challenge to Barack Obama.","After 16 years, the Clinton era may be coming to an end, presenting Democrats with a historic but potentially wrenching transition and a challenge to Senator Barack Obama as he seeks to reconcile a deeply divided party.","{'main': 'For the Democrats, Signs of a Possible Changing of the Guard', 'kicker': 'Political Memo', 'content_kicker': None, 'print_headline': 'For the Democrats, Signs of a Possible Changing of the Guard', 'name': None, 'seo': None, 'sub': None}","For the Democrats, Signs of a Possible Changing of the Guard",0.0,1.0,0.0,0.4666666666666666,0.0,1.0,2008,5
The unanimous vote was cast after efforts to squeeze concessions out of Vallejo City employees failed and with the city facing a $16 million shortfall for the fiscal year.,"VALLEJO, Calif.  In a potentially ominous harbinger for some cities in California and elsewhere, the Vallejo City Council voted to declare bankruptcy Tuesday night in the face of dwindling tax revenues, the housing market meltdown and a faltering economy.","{'main': 'City Council in Bay Area Declares Bankruptcy', 'kicker': None, 'content_kicker': None, 'print_headline': 'City Council In Bay Area Declares Bankruptcy', 'name': None, 'seo': None, 'sub': None}",City Council in Bay Area Declares Bankruptcy,-0.5,0.3,0.0,1.0,0.0,0.0,2008,5
"The campaign said 1,500 people attended the event, which brought in close to $1 million, although the crowd was not without agitators.","Senator Hillary Rodham Clinton spoke to about 1,500 supporters Wednesday night at a “Generations of Women for Hillary” fund-raiser at the Omni Shoreham Hotel in Washington. The campaign said the event brought in close to $1 million, although the crowd was not without agitators.","{'main': 'Protestor at ‘Generations of Women for Hillary’ Event', 'kicker': 'The Caucus', 'content_kicker': None, 'print_headline': None, 'name': None, 'seo': None, 'sub': None}",Protestor at ‘Generations of Women for Hillary’ Event,0.0,0.0,0.0,0.0,0.0,0.0,2008,5
"Senator Barbara Mikulski praised Senator Clinton for overcoming, among other things, the hostility of the media, which she derided as “the petulant parsing pundits,” spitting out each “p” to underscore her disdain.",What is it about Maryland politicians and alliterative slurs against the media?,"{'main': 'Senator Mikulski Criticizes Media', 'kicker': 'The Caucus', 'content_kicker': None, 'print_headline': None, 'name': None, 'seo': None, 'sub': None}",Senator Mikulski Criticizes Media,-0.125,0.375,0.0,0.0,0.0,0.0,2008,5
"“Mom” makes a campaign appearance, just in time for Mother’s Day.",No one has made a political advertisement this cycle about apple pie -– Rudolph W. Giuliani’s classic about fruitcake does not count — but motherhood spots have been popular. ,"{'main': 'Candidates Turning to Mom', 'kicker': 'The Caucus', 'content_kicker': None, 'print_headline': None, 'name': None, 'seo': None, 'sub': None}",Candidates Turning to Mom,0.0,0.0,0.25555555555555554,0.3888888888888889,0.0,0.0,2008,5
"About 12 police officers were videotaped on Monday beating three suspects in response to a drug-related shooting, and six have been removed from street patrols.","PHILADELPHIA  About 12 police officers were videotaped on Monday beating three men stopped in response to a drug-related shooting, and six of the officers have been removed from patrols, Police Commissioner Charles H. Ramsey said Wednesday.","{'main': 'Police Beating of Suspects Is Taped by TV Station in Philadelphia', 'kicker': None, 'content_kicker': None, 'print_headline': 'Police Beating of Suspects Is Taped by TV Station in Philadelphia', 'name': None, 'seo': None, 'sub': None}",Police Beating of Suspects Is Taped by TV Station in Philadelphia,0.0,0.0,0.0,0.0,0.0,0.0,2008,5
Rumors of a Texas-style police crackdown are common in the hothouse world of religious polygamy.,"COLORADO CITY, Ariz.  As the supper dishes were being cleared away and the rice pudding brought out for dessert, Marvin Wyler’s two wives, along with some of their children and a group of friends, began poring over the list.","{'main': 'Raid on Sect in Texas Rattles Other Polygamists', 'kicker': None, 'content_kicker': None, 'print_headline': 'Raid on Sect in Texas Rattles Polygamist Faithful Elsewhere', 'name': None, 'seo': None, 'sub': None}",Raid on Sect in Texas Rattles Other Polygamists,-0.15,0.375,0.0,0.0,-0.125,0.375,2008,5
"The awards represent the largest chunk of money given at one time by California’s taxpayer-backed stem cell program, which plans to spend about $3 billion over a decade.","LOS ANGELES  California has awarded $271 million in grants to build 12 stem cell research centers in the state, even as one of the political rationales for the building program might soon disappear. ","{'main': '$271 Million for Research on Stem Cells in California', 'kicker': None, 'content_kicker': None, 'print_headline': '$271 Million For Research On Stem Cells In California', 'name': None, 'seo': None, 'sub': None}",$271 Million for Research on Stem Cells in California,0.0,0.0,0.0,0.1,0.0,0.0,2008,5
"The blaze raised questions about the future of Our Lady of the Lake University, which has been losing enrollment for nine years and has an endowment of only $27 million.","SAN ANTONIO  Officials of a Roman Catholic university here vowed on Wednesday to rebuild after a fire on Tuesday night substantially damaged the Gothic-style Main Building, which serves as both its administrative offices and its signature on the city’s skyline. ","{'main': 'Hit by Fire, a Texas University Looks to Rebuild', 'kicker': None, 'content_kicker': None, 'print_headline': 'Hit by Fire, a Texas University Looks to Rebuild', 'name': None, 'seo': None, 'sub': None}","Hit by Fire, a Texas University Looks to Rebuild",0.0,0.5625,0.08333333333333333,0.21666666666666667,0.0,0.0,2008,5
"Hillary Rodham Clinton cited an Associated Press article “that found how Senator Obama’s support among working, hard-working Americans, white Americans, is weakening again, and how whites in both states who had not completed college were supporting me.”",As if the divisions between race and gender in the Democratic Party hadn’t been further exposed through Tuesday night’s exit polls — and by a very heated exchange on CNN between Donna Brazile and Paul Begala — Senator Hillary Rodham Clinton’s  interview with USA Today on Wednesday is further mining those tense depths. ,"{'main': 'Clinton Touts White Support', 'kicker': 'The Caucus', 'content_kicker': None, 'print_headline': None, 'name': None, 'seo': None, 'sub': None}",Clinton Touts White Support,0.125,0.125,-0.033333333333333326,0.45,0.0,0.0,2008,5
"On what was probably one of the toughest days of her campaign so far, Hillary Rodham Clinton put on her battle face for a speech in West Virginia.","SHEPHERDSTOWN, W.Va.  Senator Hillary Rodham Clinton’s greatest gift may be her ability to remain upright and smiling as chaos and chagrin surround her.","{'main': 'Amid Talk of the End and Boos From the Crowd, Clinton Carries On', 'kicker': None, 'content_kicker': None, 'print_headline': 'Amid Talk of the End and Boos From the Crowd, Clinton Carries On', 'name': None, 'seo': None, 'sub': None}","Amid Talk of the End and Boos From the Crowd, Clinton Carries On",0.1,1.0,1.0,1.0,0.0,0.0,2008,5
The Republicans have stepped up their criticisms of Barack Obama in recent weeks while practically ignoring Hillary Rodham Clinton.,"At least one political party is acting like it knows who the Democratic nominee will be: the Republicans, who have greatly stepped up their criticisms of Senator Barack Obama in recent weeks while practically ignoring Senator Hillary Rodham Clinton.","{'main': 'Republicans Focus on Obama as Fall Opponent', 'kicker': None, 'content_kicker': None, 'print_headline': 'Republicans Focus on Obama as Fall Opponent', 'name': None, 'seo': None, 'sub': None}",Republicans Focus on Obama as Fall Opponent,0.0,0.25,0.1,0.3,0.0,0.0,2008,5
"The conventional wisdom of the pundit class has shifted against Mrs. Clinton, possibly irretrievably.","Very early this morning, after many voters had already gone to sleep, the conventional wisdom of the elite political pundit class that resides on television shifted hard, and possibly irretrievably, against Senator Hillary Clinton’s continued viability as a presidential candidate.","{'main': 'Pundits Declare the Race Over', 'kicker': None, 'content_kicker': None, 'print_headline': None, 'name': None, 'seo': None, 'sub': None}",Pundits Declare the Race Over,-0.07142857142857142,0.6785714285714286,0.032579365079365076,0.481468253968254,0.0,0.0,2008,5
