abstract,lead_paragraph,headline,headline_main,abstract_polarity,abstract_subjectivity,lead_paragraph_polarity,lead_paragraph_subjectivity,headline_polarity,headline_subjectivity,year,month
"When motorcyclists have trouble meeting the physical demands of a bike, many decide that it might be time to add a third wheel.","MOUNT AIRY, N.C. — In his nearly 50 years as an avid motorcyclist, Grady Howard has roared down the tobacco roads of North Carolina and through the mountains of old Kentucky, all with his wife, Barbara, tucked behind him. But with a balky left leg and myriad other maladies, he knew the only way to stay wild was to add a wheel.","{'main': 'Born to Be Wild, Aging Bikers Settle for Comfy', 'kicker': None, 'content_kicker': None, 'print_headline': 'Born to Be Wild, Aging Bikers Settle for Comfy', 'name': None, 'seo': None, 'sub': None}","Born to Be Wild, Aging Bikers Settle for Comfy",0.075,0.21071428571428572,-0.01450617283950618,0.48487654320987655,0.1,0.4,2012,9
"In his Republican counterpart’s home state, Vice President Joseph R. Biden Jr. focused on issues like tax cuts for the wealthy on a day dominated by events overseas.","EAU CLAIRE, Wis. — Vice President Joseph R. Biden Jr. told a joke on himself Thursday while campaigning here. “I’m supposedly an expert on foreign policy,” he said. “Where I come from, an expert is anyone from out of town with a briefcase.” ","{'main': 'Biden Hammers G.O.P. Ticket’s Domestic Policies', 'kicker': None, 'content_kicker': None, 'print_headline': 'Biden Hammers G.O.P. Ticket’s Domestic Policies', 'name': None, 'seo': None, 'sub': None}",Biden Hammers G.O.P. Ticket’s Domestic Policies,0.5,1.0,-0.125,0.125,0.0,0.1,2012,9
"President Obama has taken away Mitt Romney’s advantage as the candidate voters say is most likely to restore the economy, according to the latest poll by The New York Times and CBS News.","President Obama has taken away Mitt Romney’s longstanding advantage as the candidate voters say is most likely to restore the economy and create jobs, according to the latest poll by The New York Times and CBS News, which found a modest sense of optimism among Americans that White House policies are working.","{'main': 'Poll Finds Obama Is Erasing Romney’s Edge on Economy', 'kicker': None, 'content_kicker': None, 'print_headline': 'Poll Finds Obama Is Erasing Romney’s Edge on Economy', 'name': None, 'seo': None, 'sub': None}",Poll Finds Obama Is Erasing Romney’s Edge on Economy,0.28409090909090906,0.7136363636363636,0.20606060606060606,0.6257575757575757,0.0,0.0,2012,9
"The University of Texas at Austin and North Dakota State University in Fargo, N.D., had ordered campus evacuations on Friday morning.",DALLAS — The authorities in Texas and North Dakota said on Friday that they had found no explosives after two large public universities were evacuated over bomb threats — false alarms that forced tens of thousands of students and staff members to flee in the middle of classes at the University of Texas at Austin and at North Dakota State University in Fargo.,"{'main': 'No Explosives Found After Bomb Threats at Colleges', 'kicker': None, 'content_kicker': None, 'print_headline': None, 'name': None, 'seo': None, 'sub': None}",No Explosives Found After Bomb Threats at Colleges,0.0,0.0,-0.09714285714285717,0.259047619047619,0.0,0.0,2012,9
President Obama will accompany Secretary of State Hillary Rodham Clinton for a ceremony formally transferring the remains of Ambassador J. Christopher Stevens and the other three Americans who were killed during an attack on the United States Consulate in Benghazi.,"President Obama plans to go to Joint Base Andrews outside Washington on Friday afternoon to mark the return of the four Americans slain in Libya, the White House announced.","{'main': 'Obama to Attend Ceremony Honoring Americans Slain in Libya', 'kicker': 'The Caucus', 'content_kicker': None, 'print_headline': None, 'name': None, 'seo': None, 'sub': None}",Obama to Attend Ceremony Honoring Americans Slain in Libya,-0.1625,0.1875,-0.26666666666666666,0.35000000000000003,0.0,0.0,2012,9
"President Obama sat down with intelligence officials on Friday for his Presidential Daily Briefing. That might not sound all that surprising, but despite its title, this does not actually happen daily.","President Obama sat down with intelligence officials on Friday for his presidential daily briefing. That might not sound all that surprising, but despite its title, this does not actually happen daily.","{'main': 'After Libya Attacks, Questions About Presidential Briefing Habits', 'kicker': 'The Caucus', 'content_kicker': None, 'print_headline': None, 'name': None, 'seo': None, 'sub': None}","After Libya Attacks, Questions About Presidential Briefing Habits",0.0574074074074074,0.21481481481481482,0.0574074074074074,0.21481481481481482,0.0,0.0,2012,9
President Obama and Mitt Romney have entered new political terrain with the killings of four United States diplomats in Libya.,"GOLDEN, Colo. — President Obama and Mitt Romney entered new political terrain on Thursday as their campaign debate moved more solidly onto issues of foreign policy, a subject that had largely been absent as a major general election issue until this week.","{'main': 'Events Abroad Take Bigger Slice of Campaign Debate', 'kicker': None, 'content_kicker': None, 'print_headline': 'Events Abroad Take Bigger Slice of Campaign Debate', 'name': None, 'seo': None, 'sub': None}",Events Abroad Take Bigger Slice of Campaign Debate,0.06818181818181818,0.2772727272727273,0.0971482683982684,0.35414502164502165,0.0,0.5,2012,9
Natasha’s Law requires trainers and coaches at public schools to undergo training on how to react when players get concussions.,"As public school athletic programs adjust to a new state law on how to respond when student athletes get concussions on the field, doctors and legislators say the health of the players will benefit.","{'main': 'Texas Law to Protect Student Athletes With Concussions Takes Effect', 'kicker': 'The Texas Tribune', 'content_kicker': None, 'print_headline': 'Law to Protect Student Athletes With Concussions Takes Effect', 'name': None, 'seo': None, 'sub': None}",Texas Law to Protect Student Athletes With Concussions Takes Effect,0.0,0.06666666666666667,0.06818181818181818,0.2606060606060606,0.0,0.0,2012,9
The FiveThirtyEight forecast model figures that President Obama’s convention bounce probably causes poll results to exaggerate his standing.,"On Thursday at 6:30 p.m. Eastern time, there was a deluge of comments in my Twitter feed when NBC News and Marist University released poll results showing President Obama with clear leads in three swing states. Mr. Obama led by five points in their polls of Virginia and Florida, and by seven in their poll of Ohio.","{'main': 'Sept. 13: After Convention Bounce, Holding Obama’s Polls to a Higher Standard', 'kicker': None, 'content_kicker': None, 'print_headline': None, 'name': None, 'seo': None, 'sub': None}","Sept. 13: After Convention Bounce, Holding Obama’s Polls to a Higher Standard",0.0,0.0,0.09999999999999999,0.3833333333333333,0.125,0.25,2012,9
"Paul D. Ryan dialed up the rhetoric against President Obama a few degrees hotter than it has been, caustically accusing the president of only being able “to talk a good game.”","Paul D. Ryan dialed up the Republican rhetoric against President Obama a few degrees hotter than it has been, caustically accusing the president of only being able “to talk a good game” and of using “straw-man arguments” because he has no record on which to run.","{'main': 'Speaking at Values Voter Summit, Ryan Says Obama Creates ‘Straw-Man’ Issues', 'kicker': 'The Caucus', 'content_kicker': None, 'print_headline': None, 'name': None, 'seo': None, 'sub': None}","Speaking at Values Voter Summit, Ryan Says Obama Creates ‘Straw-Man’ Issues",0.12,0.545,0.12,0.545,0.0,0.0,2012,9
The Commerce Department issued a formal disaster declaration that could pave the way for financial relief for the battered industry and the communities that depend on it.,"BOSTON — The Commerce Department on Thursday issued a formal disaster declaration for the Northeastern commercial groundfish fishery, paving the way for financial relief for the battered industry and the communities that depend on it.","{'main': 'U.S. Declares a Disaster for Fishery in Northeast', 'kicker': None, 'content_kicker': None, 'print_headline': 'U.S. Declares A Disaster For Fishery In Northeast', 'name': None, 'seo': None, 'sub': None}",U.S. Declares a Disaster for Fishery in Northeast,0.0,0.0,0.0,0.0,0.0,0.0,2012,9
"Under the Voting Rights Act, five counties needed clearance to change procedures. Under the ruling, they must offer 96 hours over eight days, the maximum allowed.","MIAMI — The Department of Justice has approved Florida’s early voting schedule for the five counties in the state protected by a civil rights-era law, all but clearing the last significant conflict in the path of November balloting.","{'main': 'Court Approves Schedule for Florida Early Voting', 'kicker': None, 'content_kicker': None, 'print_headline': 'Court Approves Schedule For Florida Early Voting', 'name': None, 'seo': None, 'sub': None}",Court Approves Schedule for Florida Early Voting,0.0,0.0,0.15833333333333333,0.4138888888888889,0.1,0.3,2012,9
Elizabeth Warren’s new 30-second advertisement is the first to venture off safe ground and is a sign of how much the Senate race in Massachusetts is intensifying in the run-up to the first debate.,"BOSTON — Elizabeth Warren is throwing the first punch in the ad wars in the increasingly bitter Massachusetts Senate race, with a new television commercial on Thursday that accuses Senator Scott P. Brown, her Republican opponent, of “siding with the big-money guys.” ","{'main': 'Warren Ad Paints Her as a Fighter, and Throws a Punch', 'kicker': 'The Caucus', 'content_kicker': None, 'print_headline': None, 'name': None, 'seo': None, 'sub': None}","Warren Ad Paints Her as a Fighter, and Throws a Punch",0.2672727272727273,0.3642424242424242,0.0715909090909091,0.32196969696969696,0.0,0.0,2012,9
"The folks in charge, Republicans and Democrats alike, have made things safer for the folks in charge.","​Ross Ramsey, the executive editor of The Texas Tribune, writes a column for The Tribune.","{'main': 'Dead or Alive, Voters Will Find Choices Limited at Polling Places', 'kicker': 'The Texas Tribune', 'content_kicker': None, 'print_headline': 'Dead or Alive, Voters Will Find Choices Limited At Polling Places', 'name': None, 'seo': None, 'sub': None}","Dead or Alive, Voters Will Find Choices Limited at Polling Places",0.0,0.0,0.0,0.0,-0.05714285714285714,0.3142857142857143,2012,9
"Line by line, an account of the results if Washington fails to act to head off about $100 billion spending cuts scheduled to begin Jan. 2, 2013.","WASHINGTON — Army operations and maintenance would lose nearly $7 billion next year, and the Navy more than $4 billion under a looming series of automatic cuts in federal spending. Educational achievement and special-education programs would be shaved by $2.3 billion. Medicare payments to hospitals would fall by $5.6 billion. ","{'main': 'White House Details Potential Effects If Automatic Budget Cuts Go Through', 'kicker': None, 'content_kicker': None, 'print_headline': 'White House Details Potential Effects If Automatic Budget Cuts Go Through', 'name': None, 'seo': None, 'sub': None}",White House Details Potential Effects If Automatic Budget Cuts Go Through,-0.5,0.3,0.2125,0.2875,0.0,0.5,2012,9
President Obama said the victims “laid down their lives for us all” and vowed to honor their memory by never retreating from the world.,WASHINGTON -- Four flag-draped coffins bearing the bodies of the Americans killed in Libya arrived in the United States on Friday for their final journey home as President Obama said the victims “laid down their lives for us all” and vowed to honor their memory by never retreating from the world.,"{'main': 'Somber Ceremony as Bodies of Slain Americans Return', 'kicker': None, 'content_kicker': None, 'print_headline': 'Somber Ceremony as Bodies of Slain Americans Return', 'name': None, 'seo': None, 'sub': None}",Somber Ceremony as Bodies of Slain Americans Return,-0.15555555555555556,0.2888888888888889,-0.11851851851851852,0.42962962962962964,0.0,0.0,2012,9
A Kansas man withdrew a petition in which he argued that President Obama should be removed from the state’s election ballot because he did not meet citizenship requirements.,"KANSAS CITY, Mo. — Citing a wave of angry backlash, a Kansas man on Friday withdrew a petition in which he argued that President Obama should be removed from the state’s election ballot because he did not meet citizenship requirements.","{'main': 'Kansas Ballot Challenge Over Obama’s Birth Is Ended', 'kicker': None, 'content_kicker': None, 'print_headline': 'Ballot Challenge in Kansas Over Obama’s Birth Is Ended', 'name': None, 'seo': None, 'sub': None}",Kansas Ballot Challenge Over Obama’s Birth Is Ended,0.0,0.0,-0.5,1.0,0.0,0.0,2012,9
The House passed legislation on Friday that would phase out a Department of Energy loan guarantee program for clean and renewable energy projects.,The House passed legislation on Friday that would phase out a Department of Energy loan guarantee program for clean and renewable energy projects.,"{'main': 'House Passes Solyndra Act Aimed at Obama', 'kicker': 'The Caucus', 'content_kicker': None, 'print_headline': None, 'name': None, 'seo': None, 'sub': None}",House Passes Solyndra Act Aimed at Obama,0.3666666666666667,0.7000000000000001,0.3666666666666667,0.7000000000000001,0.0,0.0,2012,9
"Major fossil fuel companies are financing an effort to defeat President Obama, while his former allies in promoting wind and solar power are disenchanted and sitting out the campaign.","WASHINGTON — When Barack Obama first ran for president, being green was so popular that oil companies like Chevron were boasting about their commitment to renewable energy, and his Republican opponent, John McCain, supported action on global warming.","{'main': 'Fossil Fuel Industry Ads Dominate TV Campaign', 'kicker': 'The Energy Rush', 'content_kicker': None, 'print_headline': 'Fossil Fuel Ads Dominate TV In Campaign', 'name': None, 'seo': None, 'sub': None}",Fossil Fuel Industry Ads Dominate TV Campaign,0.03125,0.25,0.14999999999999997,0.32666666666666666,0.0,0.0,2012,9
Tying Egypt’s debt forgiveness to the country’s efforts to protect American interests there and shaping a post-Qaddafi Libya were among the specific positions Mitt Romney’s advisers said he would take.,"WASHINGTON — If Mitt Romney were in the Oval Office during this week of turmoil in the Middle East, his foreign policy advisers said on Thursday, he would have already told Iran that he would not allow it to get close to building a bomb, setting a “red line” in a far different place from President Obama’s. ","{'main': 'Amid Mideast Turmoil, Aides Say What a President Romney Would Do', 'kicker': None, 'content_kicker': None, 'print_headline': 'Amid Mideast Turmoil, Aides Say What a President Romney Would Do', 'name': None, 'seo': None, 'sub': None}","Amid Mideast Turmoil, Aides Say What a President Romney Would Do",0.0,0.0625,-0.004999999999999999,0.34500000000000003,0.0,0.0,2012,9
"Rising unrest in the Arab world will dominate this week’s Sunday shows, with each broadcast focusing almost exclusively on diplomacy and the fallout from the attack that killed four Americans at the U.S. Consulate in Benghazi, Libya.","Rising unrest in the Arab world will dominate this week’s Sunday shows, with each broadcast focusing almost exclusively on diplomacy and the fallout from the attack that killed four Americans at the United States Consulate in Benghazi, Libya.","{'main': 'Sunday Breakfast Menu, Sept. 16', 'kicker': 'The Caucus', 'content_kicker': None, 'print_headline': None, 'name': None, 'seo': None, 'sub': None}","Sunday Breakfast Menu, Sept. 16",-0.2,0.0,-0.2,0.0,0.0,0.0,2012,9
"The ad war also heats up, in the country’s most expensive Congressional race.","Elizabeth Warren, the Democratic candidate who has seemed on the ropes in the hard-fought Massachusetts Senate race, has planned a major rally for Saturday in Boston with Gov. Deval Patrick.","{'main': 'A Rally for Warren, as Massachusetts Senate Race Intensifies', 'kicker': 'The Caucus', 'content_kicker': None, 'print_headline': None, 'name': None, 'seo': None, 'sub': None}","A Rally for Warren, as Massachusetts Senate Race Intensifies",0.0,0.6,0.0625,0.5,0.0,0.0,2012,9
"Elizabeth Warren, campaigning for Senate in Massachusetts, attacks the votes of the incumbent, Scott P. Brown, a Republican.","9:35 a.m. | Updated BOSTON — During a rally on Saturday, Elizabeth Warren questioned the record and credibility of Senator Scott P. Brown, energizing a crowd of more than 700 people as the Senate race in Massachusetts turned more aggressive and pointed.","{'main': 'At Rally, Elizabeth Warren Takes More Aggressive Stance', 'kicker': 'The Caucus', 'content_kicker': None, 'print_headline': None, 'name': None, 'seo': None, 'sub': None}","At Rally, Elizabeth Warren Takes More Aggressive Stance",0.0,0.0,0.5,0.5,0.5,0.5,2012,9
John and Linda Parsons found themselves disappointed after their initial attraction to a Christian-themed cohousing development in Washington State.,"BREMERTON, Wash. — In 2005, John and Linda Parsons decided to downsize. They were each about 50 years old, with two sons nearing college age. The time seemed right to leave their house on Bainbridge Island, near Seattle. They would sacrifice square footage for a lower mortgage.","{'main': 'Soul-Searching in a Christian Community Over Views on How to Live', 'kicker': 'Beliefs', 'content_kicker': None, 'print_headline': 'Soul-Searching in a Christian Community Over Views on How to Live', 'name': None, 'seo': None, 'sub': None}",Soul-Searching in a Christian Community Over Views on How to Live,-0.375,0.375,0.16190476190476188,0.37857142857142856,0.06818181818181818,0.25,2012,9
"The annual Striped Bass and Bluefish Derby knits a Martha’s Vineyard town of 15,000 back together after its residents live among a summer population swelling to 105,000.","EDGARTOWN, Mass. — Striped bass are nocturnal, and every year at this time, Kathi Pogoda becomes nocturnal too.","{'main': 'With the Crowds Gone, It’s Down to Serious Fishing', 'kicker': 'Edgartown Journal', 'content_kicker': None, 'print_headline': 'With the Crowds Gone, It’s Down to Serious Fishing', 'name': None, 'seo': None, 'sub': None}","With the Crowds Gone, It’s Down to Serious Fishing",-0.0045454545454545565,0.3333333333333333,-0.15000000000000002,0.5,-0.24444444444444444,0.47777777777777775,2012,9
"Political news from today’s Times and around the Web, plus a look at the weekly addresses and the latest happenings in Washington.",Today’s Times,"{'main': 'The Early Word: Toss-Up', 'kicker': 'The Caucus', 'content_kicker': None, 'print_headline': None, 'name': None, 'seo': None, 'sub': None}",The Early Word: Toss-Up,0.25,0.5,0.0,0.0,0.1,0.3,2012,9
"Paul D. Ryan, the Republican vice presidential candidate, uses an appearance to attack President Obama, while Mitt Romney and his wife chat it up with TV hosts.","PAINESVILLE, Ohio — One of the advantages of the partnership between Mitt Romney and Paul D. Ryan is their ability to offer varied messages on the campaign trail — unusually varied, as shown on Friday. The running mates punched a list of campaign goals — rallying the conservative base, turning up the heat on President Obama and reaching out to women watching morning television — when each day counting down to Nov. 6 matters.","{'main': 'While Ryan Throws Hardballs, Romney Makes Friends on Morning TV', 'kicker': None, 'content_kicker': None, 'print_headline': 'While Ryan Throws Hardballs, Romney Makes Friends on Morning TV', 'name': None, 'seo': None, 'sub': None}","While Ryan Throws Hardballs, Romney Makes Friends on Morning TV",0.0,0.0,-0.2518518518518519,0.762962962962963,0.0,0.0,2012,9
The new Mexican-American Student Services program also aims to mend fences broken in the acrimony over the dismantling of the Mexican-American studies department last school year.,"TUCSON — The forecast for the year ahead is dire, so officials in the public school district here, the oldest in the state, summoned parents to an urgent meeting one evening to lay out the options: close schools and increase class sizes or impose across-the-board pay cuts, making it harder for the district to recruit quality teachers. ","{'main': 'Tucson Schools Overhaul a Program to Help Struggling Hispanic Students', 'kicker': None, 'content_kicker': None, 'print_headline': 'Tucson Schools Overhaul a Program to Help Struggling Hispanic Students', 'name': None, 'seo': None, 'sub': None}",Tucson Schools Overhaul a Program to Help Struggling Hispanic Students,-0.08787878787878789,0.30707070707070705,0.0,0.32222222222222224,0.0,0.0,2012,9
"A Dane County Circuit judge said the state law violated federal and state Constitutions with regard to city, county and school district workers.",A county judge in Wisconsin on Friday struck down much of the 2011 state law pushed through by Gov. Scott Walker that severely restricts the ability of public employees to bargain collectively.,"{'main': 'County Judge Strikes Down Some Restrictions on Public Unions in Wisconsin Law', 'kicker': None, 'content_kicker': None, 'print_headline': 'County Judge Strikes Down Some Restrictions on Public Unions in Wisconsin Law', 'name': None, 'seo': None, 'sub': None}",County Judge Strikes Down Some Restrictions on Public Unions in Wisconsin Law,0.0,0.0,0.014814814814814817,0.1851851851851852,-0.07777777777777778,0.17777777777777778,2012,9
Recent polls have shown that more Americans feel that they are not better off. But President Obama is telling them that they are.,A new ad from President Obama confronts head on one of the most potentially damaging questions lingering over his re-election hopes: Are you better off than you were four years ago?,"{'main': 'Obama Ad Tries to Answer: Are You Better Off Than Four Years Ago?', 'kicker': 'The Caucus', 'content_kicker': None, 'print_headline': None, 'name': None, 'seo': None, 'sub': None}",Obama Ad Tries to Answer: Are You Better Off Than Four Years Ago?,0.08333333333333333,0.4166666666666667,0.28409090909090906,0.6136363636363636,0.2,0.45,2012,9
Getting the blame for gridlock has prompted a different approach for some candidates as Election Day draws near.,"WASHINGTON — A woman who appears in an advertisement supporting Representative Jon Runyan, a New Jersey Republican, boasts about how he works “with both parties.” ","{'main': 'Some Republicans Try Out a New Campaign Theme: Bipartisanship', 'kicker': None, 'content_kicker': None, 'print_headline': 'Some Republicans Try Out a New Campaign Theme: Bipartisanship', 'name': None, 'seo': None, 'sub': None}",Some Republicans Try Out a New Campaign Theme: Bipartisanship,0.05,0.5,0.19318181818181818,0.3522727272727273,0.13636363636363635,0.45454545454545453,2012,9
"Leobardo Espinoza Jr., a student at Topeka High School in Kansas, is one of eight high school seniors around the world who are blogging about their college searches.","My full name is Leobardo Espinoza Jr., but everyone here calls me Leo. It’s shorter to say and easier for everyone to understand. I was born in California and moved to Topeka, Kan., when I was in the sixth grade.","{'main': 'Beginning a Journey That Could Make Family History', 'kicker': 'The Choice', 'content_kicker': None, 'print_headline': None, 'name': None, 'seo': None, 'sub': None}",Beginning a Journey That Could Make Family History,0.16,0.54,0.35,0.55,0.0,0.0,2012,9
"The man, an American citizen, expressed interest online in carrying out a deadly attack, law enforcement officials said.","An 18-year-old suburban Chicago man, who the authorities say was enamored with Osama bin Laden and intent on killing Americans, has been arrested after attempting to detonate what he thought was a car bomb outside a Chicago bar, officials said Saturday.","{'main': 'Man Is Accused of Jihadist Plot to Bomb a Bar in Chicago', 'kicker': None, 'content_kicker': None, 'print_headline': 'Chicago-Area Teenager Accused of Terrorism Plot', 'name': None, 'seo': None, 'sub': None}",Man Is Accused of Jihadist Plot to Bomb a Bar in Chicago,-0.1,0.2,0.0,0.025,0.0,0.0,2012,9
"William Goetzee, a Coast Guard officer in New Orleans whose life was intertwined with the city’s ordeals, committed suicide in 2011 in the notorious Orleans Parish Prison.","NEW ORLEANS — Over the past year, in churches full of citizens railing at the state of the city jail, and in courtrooms where the thousands of young men who populate that jail rotate glumly through the sentencing process, a middle-aged woman could be seen sitting quietly. Her name is Donna Gauthier and she had not given much thought to the criminal justice system, other than to assume that if you had the misfortune of ending up in it, they would at least take care of you.","{'main': 'A Suicide in a Troubled Jail Mirrors New Orleans’s Ordeals', 'kicker': None, 'content_kicker': None, 'print_headline': 'A Suicide in a Troubled Jail Mirrors New Orleans’s Ordeals', 'name': None, 'seo': None, 'sub': None}",A Suicide in a Troubled Jail Mirrors New Orleans’s Ordeals,0.13636363636363635,0.45454545454545453,-0.04442148760330579,0.3193526170798898,-0.15454545454545454,0.48484848484848486,2012,9
