abstract,lead_paragraph,headline,headline_main,abstract_polarity,abstract_subjectivity,lead_paragraph_polarity,lead_paragraph_subjectivity,headline_polarity,headline_subjectivity,year,month
The findings represent some of the final steps in what has been a three-year investigation into Representative Maxine Waters’s actions during the financial crisis.,"WASHINGTON — Representative Maxine Waters, Democrat of California, did not violate House ethics rules when she contacted the Treasury Department in 2008 to set up a meeting on behalf of top executives from a bank her husband owns stock in, a special investigator announced on Friday.","{'main': 'Lawmaker Didn’t Break Ethics Rules in Bank Case, Investigator Finds', 'kicker': None, 'content_kicker': None, 'print_headline': 'Lawmaker Didn’t Break Ethics Rules in Bank Case, Investigator Finds', 'name': None, 'seo': None, 'sub': None}","Lawmaker Didn’t Break Ethics Rules in Bank Case, Investigator Finds",0.0,0.5,0.4285714285714286,0.5357142857142857,0.0,0.0,2012,9
"Campaign filings, and disclosures by major “super PACs” supporting both candidates, challenge the appearance of financial strength that Mitt Romney enjoyed over the summer.","Mitt Romney entered the final months of the presidential campaign with a cash balance of just $35 million, racing to find new large donors and rally low-dollar contributors in August even while he raised tens of millions of dollars for the Republican Party.","{'main': 'Low on Cash, Romney Tries to Rally Donors for Final Phase', 'kicker': None, 'content_kicker': None, 'print_headline': 'Cash Low, Romney Striving To Find New Large Donors', 'name': None, 'seo': None, 'sub': None}","Low on Cash, Romney Tries to Rally Donors for Final Phase",0.22916666666666666,0.42333333333333323,0.11688311688311688,0.6277056277056278,-0.03333333333333333,0.5666666666666667,2012,9
"If there was any doubt that Mitt Romney’s secretly recorded comments about the “47 percent” had jumped beyond the presidential campaign, it was erased with the first question of the Virginia Senate debate on Thursday.","If there was any doubt that Mitt Romney‘s secretly recorded comments about the “47 percent” had jumped beyond the presidential campaign, it was erased with the first question of the Virginia Senate debate on Thursday.","{'main': 'Fallout From ‘47 Percent’ Comment Hits Senate Campaigns', 'kicker': 'The Caucus', 'content_kicker': None, 'print_headline': None, 'name': None, 'seo': None, 'sub': None}",Fallout From ‘47 Percent’ Comment Hits Senate Campaigns,-0.07500000000000001,0.5166666666666666,-0.07500000000000001,0.5166666666666666,0.0,0.0,2012,9
A Republican bill to provide permanent resident visas for foreigners who graduate from American universities with advanced degrees in science and technology failed to pass the House on Thursday.,"A Republican bill to provide permanent resident visas for foreigners who graduate from American universities with advanced degrees in science and technology failed to pass the House on Thursday, a setback for technology companies that had strongly supported it. ","{'main': 'Bill to Keep Graduates in U.S. Fails in the House', 'kicker': None, 'content_kicker': None, 'print_headline': 'Bill to Keep Graduates In U.S. Fails In the House', 'name': None, 'seo': None, 'sub': None}",Bill to Keep Graduates in U.S. Fails in the House,-0.033333333333333326,0.3,0.08333333333333334,0.4083333333333333,-0.5,0.3,2012,9
"Political news from Friday’s Times, plus a look at what’s happening in Washington.",In Today’s Times:,"{'main': 'The Early Word: China', 'kicker': 'The Caucus', 'content_kicker': None, 'print_headline': None, 'name': None, 'seo': None, 'sub': None}",The Early Word: China,0.0,0.1,0.0,0.0,0.1,0.3,2012,9
"The family of Brian A. Terry, a Border Patrol agent who died in a shootout linked to Operation Fast and Furious, has sought answers after revelations over his death.","NACO, Ariz. — “There’s the sign,” Kent Terry Jr. exclaimed as the chartered bus pulled into the Border Patrol station, a compound on an expanse of sand and brush bearing the name of his younger brother, who was killed in a shootout linked to a botched gun-smuggling operation known as Fast and Furious.","{'main': 'A Family Pulled Into the Fray Over an Agent’s Death', 'kicker': None, 'content_kicker': None, 'print_headline': 'A Family Pulled Into the Fray Over an Agent’s Death', 'name': None, 'seo': None, 'sub': None}",A Family Pulled Into the Fray Over an Agent’s Death,0.2,0.6,0.0,0.19999999999999998,0.0,0.0,2012,9
President Obama took aim on Thursday at Mitt Romney’s closed-door observation that 47 percent of Americans are dependent on government handouts and do not pay income taxes.,"CORAL GABLES, Fla. — President Obama took aim on Thursday at Mitt Romney’s closed-door observation that 47 percent of Americans are dependent on government handouts, do not pay income taxes and will inevitably vote for Mr. Obama, suggesting it showed how Mr. Romney is out of touch with most Americans.","{'main': 'Obama Seizes on Romney Comments, Suggesting He Is Out of Touch', 'kicker': None, 'content_kicker': None, 'print_headline': 'Obama Seizes on Romney Comments, Suggesting He Is Out of Touch', 'name': None, 'seo': None, 'sub': None}","Obama Seizes on Romney Comments, Suggesting He Is Out of Touch",0.0,0.0,0.25,0.75,0.0,0.0,2012,9
"Horse-racing veterinarians are both doctor and drugstore; the more drugs they prescribe, the more money they make.","Only after Bourbon Bandit broke a leg racing last November did his owner, Susan Kayne, learn the full extent of prescription drugs that veterinarians had given him at Belmont Park on Long Island.","{'main': 'At the Track, Racing Economics Collide With Veterinarians’ Oath', 'kicker': None, 'content_kicker': None, 'print_headline': 'At Racetrack, Economic Pressures Overpower Veterinarians’ Oath', 'name': None, 'seo': None, 'sub': None}","At the Track, Racing Economics Collide With Veterinarians’ Oath",0.5,0.5,0.075,0.5041666666666667,0.0,0.0,2012,9
"Amy Hutton, the director of admissions for the department of music at Virginia Commonwealth University, offers tips to help students choose a performing arts school and prepare for auditions.","Amy Hutton is the director of admissions for the department of music at Virginia Commonwealth University, as well as a former professor in its theater department.","{'main': 'Tip Sheet | How to Apply to a Performing Arts School', 'kicker': 'The Choice', 'content_kicker': None, 'print_headline': None, 'name': None, 'seo': None, 'sub': None}",Tip Sheet | How to Apply to a Performing Arts School,0.1,0.0,0.0,0.0,0.0,0.0,2012,9
"President Obama’s position inched forward in the FiveThirtyEight forecast on Thursday, as he continues to do well in swing states and in surveys that use industry-standard polling methodology.","President Obama’s position inched forward in the FiveThirtyEight forecast on Thursday. His chances of winning the Electoral College are 76.1 percent, according to the forecast, up from 75.2 percent on Wednesday. Mr. Obama’s projected margin of victory in the national popular vote also increased slightly, to 3.4 percentage points.","{'main': 'Sept. 20: Obama’s Convention Bounce May Not Be Receding', 'kicker': None, 'content_kicker': None, 'print_headline': None, 'name': None, 'seo': None, 'sub': None}",Sept. 20: Obama’s Convention Bounce May Not Be Receding,0.0,0.0,0.31111111111111117,0.6055555555555555,0.0,0.0,2012,9
"Overturning the president’s health care law, as Mr. Romney has pledged to do, could wipe out several benefits retirees are currently receiving because of the law.","5:47 p.m. | Updated  When Representative Paul D. Ryan faced a skeptical audience — and some boos — at the AARP convention in New Orleans on Friday, he tried to reassure them by noting that the Romney-Ryan health plan “makes no changes for those in or near retirement.”","{'main': 'Romney’s Health Plan Would Have Impact on Current Retirees', 'kicker': 'The Caucus', 'content_kicker': None, 'print_headline': None, 'name': None, 'seo': None, 'sub': None}",Romney’s Health Plan Would Have Impact on Current Retirees,0.0,0.2,-0.08787878787878789,0.4515151515151515,0.0,0.4,2012,9
"In his speech to the AARP convention Friday, President Obama provided some important context around one of his ads attacking Representative Paul D. Ryan’s Medicare plan.","President Obama’s re-election campaign released an ad on Thursday that uses an analysis of an outdated Medicare plan by Representative Paul D. Ryan to warn, “The Romney-Ryan plan could raise seniors’ costs up to $6,400 a year.”","{'main': 'For AARP Convention, Obama Plays Fact-Checker in Chief', 'kicker': 'The Caucus', 'content_kicker': None, 'print_headline': None, 'name': None, 'seo': None, 'sub': None}","For AARP Convention, Obama Plays Fact-Checker in Chief",0.4,1.0,-0.4000000000000001,0.6333333333333334,0.0,0.0,2012,9
"Vice President Joseph R. Biden Jr. and his wife, Jill, bought a 36-pound pumpkin and some pies at the Spring Ledge Farm Stand in New London, N.H., while campaigning in the swing state on Friday.",,"{'main': 'The Caucus Click: Biden Goes Pumpkin Picking', 'kicker': 'The Caucus', 'content_kicker': None, 'print_headline': None, 'name': None, 'seo': None, 'sub': None}",The Caucus Click: Biden Goes Pumpkin Picking,0.13636363636363635,0.45454545454545453,0.0,0.0,0.0,0.0,2012,9
There are 46 days left in this presidential race for Mitt Romney to change the dynamic of a campaign that by many indicators is tilting against him.,"WASHINGTON — There are seven days until early voting begins in Iowa, less than two weeks until the first debate and 46 days left in the race for Mitt Romney to change the dynamic of a campaign that by many indicators is tilting against him.","{'main': 'Before Debates, Romney Faces a Daunting Path', 'kicker': 'Political Memo', 'content_kicker': None, 'print_headline': 'Daunting Path Greets Romney Before Debates', 'name': None, 'seo': None, 'sub': None}","Before Debates, Romney Faces a Daunting Path",0.16666666666666666,0.2222222222222222,0.11388888888888889,0.22777777777777777,0.0,0.0,2012,9
"A long rise in Americans’ life spans has reversed itself for white people who lack high school diplomas, an increasingly troubled group that has lost four years of life expectancy since 1990.","For generations of Americans, it was a given that children would live longer than their parents. But there is now mounting evidence that this enduring trend has reversed itself for the country’s least-educated whites, an increasingly troubled group whose life expectancy has fallen by four years since 1990.","{'main': 'Life Spans Shrink for Least-Educated Whites in the U.S.', 'kicker': None, 'content_kicker': None, 'print_headline': 'Reversing Trend, Life Span Shrinks for Some Whites', 'name': None, 'seo': None, 'sub': None}",Life Spans Shrink for Least-Educated Whites in the U.S.,-0.0975,0.485,-0.18181818181818182,0.75,0.0,0.0,2012,9
"President Obama and Representative Paul D. Ryan each accused the other of posing a threat to the future of the Medicare program, with Mr. Obama getting a better reception.","WOODBRIDGE, Va. — President Obama traded charges with Representative Paul D. Ryan on Friday over the financing of Medicare, as each candidate sought to appeal to older voters by warning them, with arguments both familiar and new, that his opponent would threaten the future of this signature federal health care program.","{'main': 'Obama and Ryan Trade Blasts Over Medicare at AARP Convention', 'kicker': None, 'content_kicker': None, 'print_headline': 'Obama and Ryan Trade Blasts Over Medicare at AARP Convention', 'name': None, 'seo': None, 'sub': None}",Obama and Ryan Trade Blasts Over Medicare at AARP Convention,0.125,0.3333333333333333,0.16950757575757575,0.35321969696969696,0.0,0.0,2012,9
"When Jerry Brown became governor of California he estimated the state’s debt at $28 billion, but that amount is now estimated to be as much as 12 times greater.","Gov. Jerry Brown of California announced when he came into office last year that he had found an alarming $28 billion “wall of debt” looming over the state, which had to be dismantled. ","{'main': 'California Debt Higher Than Earlier Estimates, a Task Force Reports', 'kicker': None, 'content_kicker': None, 'print_headline': 'California Debt Higher Than Earlier Estimates, a Task Force Reports', 'name': None, 'seo': None, 'sub': None}","California Debt Higher Than Earlier Estimates, a Task Force Reports",0.35,0.35,-0.05,0.3333333333333333,0.125,0.5,2012,9
"The Romneys paid a higher effective tax rate than the average middle-income American, though a significantly lower rate than the average rich, or very rich, American.","The Romney campaign revealed Friday afternoon that Mitt Romney and his wife, Ann, paid a 14.1 percent effective federal tax rate in 2011, paying $1.9 million in taxes on $13.7 million in income, much of it from investments. (That $13.7 million in income most likely puts him in the top 0.01 percent of earners, by the way.) ","{'main': 'Romney’s Taxes Compared With Everyone Else’s', 'kicker': 'The Caucus', 'content_kicker': None, 'print_headline': None, 'name': None, 'seo': None, 'sub': None}",Romney’s Taxes Compared With Everyone Else’s,0.1986111111111111,0.5222222222222223,0.36,0.6,0.0,0.0,2012,9
Congress’s expected departure for the campaign trail was held up by the political fortunes of two senators battling for survival.,"WASHINGTON — Congress’s expected departure for the campaign trail was held up on Thursday by the political fortunes of two senators battling for survival, Scott P. Brown, Republican of Massachusetts, and Jon Tester, Democrat of Montana.","{'main': 'Day of Political Maneuvering and Fights Stalls Congress’s Close', 'kicker': None, 'content_kicker': None, 'print_headline': 'Day of Political Maneuvering and Fights Stalls Congress’s Close', 'name': None, 'seo': None, 'sub': None}",Day of Political Maneuvering and Fights Stalls Congress’s Close,-0.05,0.25,-0.05,0.25,0.0,0.1,2012,9
"Mitt Romney has “reserves of strength, energy and stamina that provide him with the ability to meet unexpected demands,” his personal physician wrote in a letter released by the campaign on Friday.","Mitt Romney is a “vigorous man” who has “reserves of strength, energy and stamina that provide him with the ability to meet unexpected demands,” his personal physician wrote in a letter released by the campaign on Friday.","{'main': 'Doctors Say Romney and Ryan Are in Good Health', 'kicker': 'The Caucus', 'content_kicker': None, 'print_headline': None, 'name': None, 'seo': None, 'sub': None}",Doctors Say Romney and Ryan Are in Good Health,0.05,0.65,0.05,0.65,0.7,0.6000000000000001,2012,9
"Mitt Romney paid $1.95 million in taxes on his 2011 investment income of $13.7 million, his campaign revealed on Friday.",Read the most current version of this story here.,"{'main': 'Romney Releases 2011 Tax Returns', 'kicker': 'The Caucus', 'content_kicker': None, 'print_headline': None, 'name': None, 'seo': None, 'sub': None}",Romney Releases 2011 Tax Returns,0.0,0.0,0.25,0.45,0.0,0.0,2012,9
"The candidate's controversial comment did not reflect the feelings of the very rich, but of the struggling middle class that is just above the 47 percent.","ASSISI, ITALY — Kate Middleton and Mitt Romney have learned the lesson that what occurs at a French villa or a party with rich folk should be assumed to be no more private than a tweet.","{'main': 'Romney Gaffe Reflects Real Sentiments', 'kicker': 'Currents', 'content_kicker': None, 'print_headline': 'Romney Gaffe Reflects Real Sentiments', 'name': None, 'seo': None, 'sub': None}",Romney Gaffe Reflects Real Sentiments,0.259375,0.50625,0.03125,0.40625,0.2,0.30000000000000004,2012,9
"During a six-hour standoff at a downtown Pittsburgh office, a 22-year-old man’s messages of despair were answered by friends before he surrendered to the police.","PITTSBURGH — “i cant take it no more im done bro,” Klein Michael Thaxton, 22, wrote in a status update on Facebook on Friday.","{'main': 'Hostage Drama Resolved Amid Talk on Facebook', 'kicker': None, 'content_kicker': None, 'print_headline': 'Hostage Drama Resolved Amid Talk on Facebook', 'name': None, 'seo': None, 'sub': None}",Hostage Drama Resolved Amid Talk on Facebook,0.0,0.0,-0.25,0.5,0.0,0.0,2012,9
Representative Paul D. Ryan sought to reframe attention away from the low effective tax rate that Mitt Romney pays by emphasizing the Romneys’ charitable giving.,"BARTOW, Fla. — Representative Paul D. Ryan sought to reframe attention on Friday away from the low effective tax rate that Mitt Romney pays compared to many Americans who earn much less, by emphasizing that Mr. Romney and his wife, Ann, gave away about $4 million to charity in 2011.","{'main': 'Ryan Seeks to Deflect Attention Away From Romney’s Tax Returns', 'kicker': 'The Caucus', 'content_kicker': None, 'print_headline': None, 'name': None, 'seo': None, 'sub': None}",Ryan Seeks to Deflect Attention Away From Romney’s Tax Returns,0.39999999999999997,0.6333333333333334,0.23333333333333336,0.4166666666666667,0.0,0.0,2012,9
"Mitt Romney and Representative Paul D. Ryan are healthy and fit, according to medical summaries released on Friday by the Romney campaign.","Medical summaries by doctors who have regularly examined Mitt Romney and Representative Paul D. Ryan were released Friday by the Romney campaign and show both men to be conspicuously healthy and fit. Both men, however, have significant family histories of heart disease and have been closely monitored for it.","{'main': 'G.O.P. Ticket Is Picture of Health, Doctors Say', 'kicker': None, 'content_kicker': None, 'print_headline': 'G.O.P. Ticket Is Picture Of Health, Doctors Say', 'name': None, 'seo': None, 'sub': None}","G.O.P. Ticket Is Picture of Health, Doctors Say",0.3,0.3,0.255,0.3703846153846154,0.0,0.0,2012,9
"President Obama, campaigning in Wisconsin with Milwaukee Mayor Tom Barrett on Saturday, stopped at Usinger’s, a local deli founded in 1880. He ordered a kielbasa, Italian sausage and a hot sausage.",,"{'main': 'The Caucus Click: Stopping for a Snack', 'kicker': 'The Caucus', 'content_kicker': None, 'print_headline': None, 'name': None, 'seo': None, 'sub': None}",The Caucus Click: Stopping for a Snack,0.08333333333333333,0.2833333333333334,0.0,0.0,0.0,0.0,2012,9
The Senate gave final passage early Saturday morning to a stopgap spending measure that will ensure the government’s lights stay on through March.,"WASHINGTON — The Senate gave final passage early Saturday morning to a stopgap spending measure that will ensure the government’s lights stay on through March, and then closed the doors of one of the least productive Congresses in generations until after the November elections.","{'main': 'Congress Heads for Home With Rancor Still Evident', 'kicker': None, 'content_kicker': None, 'print_headline': 'Congress Heads for Home With Rancor Still Evident', 'name': None, 'seo': None, 'sub': None}",Congress Heads for Home With Rancor Still Evident,0.05,0.65,-0.075,0.45000000000000007,0.25,0.25,2012,9
"Emblematic of Mr. Obama’s good-but-not-great polling day were a set of polls, which had him ahead in four of the five swing states: Ohio, Virginia, Colorado and North Carolina.","We make an effort to be disciplined about the way that we characterize the polls each day. Generally speaking, if the FiveThirtyEight forecast moves appreciably toward President Obama, the tenor of the article is going to be favorable to him — and likewise for Mitt Romney, if the same is true for him. ","{'main': 'Sept. 21: Presidential Race Changes, but Swing States Stay the Same', 'kicker': None, 'content_kicker': None, 'print_headline': None, 'name': None, 'seo': None, 'sub': None}","Sept. 21: Presidential Race Changes, but Swing States Stay the Same",0.0,0.0,0.13333333333333333,0.425,0.0,0.125,2012,9
"Mitt Romney’s remarks at fund-raisers highlight the differences, both subtle and significant, in how he talks to voters and donors, his two key constituencies.","LAS VEGAS — In Chicago, Mitt Romney regaled wealthy donors with a boyhood memory of volunteering to clean up a litter-strewn football field, the kind of humanizing tale he typically avoids on the campaign trail.","{'main': 'With Rich Donors, a More Candid Romney Emerges', 'kicker': None, 'content_kicker': None, 'print_headline': 'Behind Closed Doors With Donors, a More Candid Romney Emerges', 'name': None, 'seo': None, 'sub': None}","With Rich Donors, a More Candid Romney Emerges",0.013888888888888895,0.7916666666666666,0.325,0.775,0.4916666666666667,0.6833333333333332,2012,9
"The closing of Interstate 405 in Los Angeles last year did not result in the nightmare that was expected, but officials fear they will not be so lucky this time.","LOS ANGELES — One year ago, a 10-mile stretch of Interstate 405 — the most heavily traveled highway in the nation, and the not-so-proud symbol of the Los Angeles traffic jam — was shut down for most of a weekend. The city went on full alert. Emergency workers were mobilized, contingency plans were made and motorists were warned — in the most dire terms — to stay off the road for what was called Carmageddon.","{'main': 'New Fears in Los Angeles as Highway Closes Again', 'kicker': None, 'content_kicker': None, 'print_headline': 'New Fears in Los Angeles As Highway Closes Again', 'name': None, 'seo': None, 'sub': None}",New Fears in Los Angeles as Highway Closes Again,0.07777777777777777,0.43333333333333335,0.2490740740740741,0.47314814814814815,0.13636363636363635,0.45454545454545453,2012,9
"The allegations against Dr. Richard Keller have raised questions at the prominent institutions on his résumé, particularly Phillips Academy in Andover, Mass.","BOSTON — In a court appearance on Friday, Dr. Richard Keller, the former medical director at a prestigious Massachusetts prep school and a part-time pediatrician at Boston Children’s Hospital, agreed to remain in jail pending a trial on a single federal count of receiving child pornography. He has been in jail since his arrest on Sept. 13.","{'main': 'Former Prep School Doctor in Child Pornography Case to Remain in Jail', 'kicker': None, 'content_kicker': None, 'print_headline': 'Former Prep School Doctor in Child Pornography Case to Remain in Jail', 'name': None, 'seo': None, 'sub': None}",Former Prep School Doctor in Child Pornography Case to Remain in Jail,0.3333333333333333,0.6666666666666666,-0.053571428571428575,0.03571428571428571,-0.05,0.0,2012,9
"For the Obamas and the Romneys, saying they like “Modern Family,” ABC’s hit sitcom, is an easy way to signal that they identify with white middle-class suburbia.","It’s not so surprising that Michelle Obama said “Modern Family” was one of her family’s favorite shows. And it’s only a little surprising that Ann Romney claimed that she and her husband, Mitt, were also devoted fans. ","{'main': 'Watching a Hit Sitcom, and Seeing Undecided Voters', 'kicker': 'The TV Watch', 'content_kicker': None, 'print_headline': 'Watching a Hit Sitcom, and Seeing Undecided Voters', 'name': None, 'seo': None, 'sub': None}","Watching a Hit Sitcom, and Seeing Undecided Voters",0.2111111111111111,0.37777777777777777,0.31875,0.6333333333333333,0.0,0.0,2012,9
"Campaign surrogates for each of the candidates have been dispatched to the Sunday shows this week, focusing less on the unrest in the Arab world and more on the economy and current climate of the campaign trail.","Campaign surrogates for each of the candidates have been dispatched to the Sunday shows this week, focusing less on the unrest in the Arab world and more on the economy and current climate of the campaign trail. But first, the candidates themselves will appear on Univision’s “Al Punto” for an in-depth look at their policies and platforms. Telemundo’s “Enfoque” will air an extended version of a sit-down with Mitt Romney, who goes into detail about what some view as problems within his campaign and United States foreign policy toward Mexico and Latin America.   Representative Xavier Becerra of California will be on hand to deliver a Democratic rebuttal.","{'main': 'Sunday Breakfast Menu, Sept. 23', 'kicker': 'The Caucus', 'content_kicker': None, 'print_headline': None, 'name': None, 'seo': None, 'sub': None}","Sunday Breakfast Menu, Sept. 23",0.11111111111111112,0.32222222222222224,0.09166666666666667,0.28500000000000003,0.0,0.0,2012,9
"Political news from today’s Times and around the Web, plus a look at the president’s weekly address and the latest happenings in Washington.",Today’s Times,"{'main': 'The Weekend Word: Tax Day', 'kicker': 'The Caucus', 'content_kicker': None, 'print_headline': None, 'name': None, 'seo': None, 'sub': None}",The Weekend Word: Tax Day,0.25,0.5,0.0,0.0,0.0,0.0,2012,9
"Mitt Romney’s 2011 tax returns show that his family trusts had invested in shares of a Chinese-owned state oil company but got rid of those investments this summer, as his anti-Chinese rhetoric heated up.","On the campaign trail, Mitt Romney has become increasingly critical of China, saying the country is engaging in unfair trade practices and vowing to crack down on them in ways that are much more severe that the current administration.","{'main': 'Romney’s Family Trust Invested in Chinese Oil Company', 'kicker': 'The Caucus', 'content_kicker': None, 'print_headline': None, 'name': None, 'seo': None, 'sub': None}",Romney’s Family Trust Invested in Chinese Oil Company,0.0,0.0,0.040740740740740744,0.6148148148148148,0.0,0.0,2012,9
