abstract,lead_paragraph,headline,headline_main,abstract_polarity,abstract_subjectivity,lead_paragraph_polarity,lead_paragraph_subjectivity,headline_polarity,headline_subjectivity,year,month
The still-simmering controversy over Elizabeth Warren’s self-proclaimed American Indian heritage has chased her from the campaign trail in Massachusetts to North Carolina.,"Karen Geronimo, a member of the Mescalero Apache tribe in town for the Democratic convention, knows what she wants from Elizabeth Warren, the Senate candidate from Massachusetts: a blood sample.","{'main': 'For Warren, Bad Blood Over Ethnic Claims', 'kicker': 'The Party', 'content_kicker': None, 'print_headline': 'For Warren, Bad Blood Over Ethnic Claims', 'name': None, 'seo': None, 'sub': None}","For Warren, Bad Blood Over Ethnic Claims",0.0,0.0,0.2,0.1,-0.6999999999999998,0.6666666666666666,2012,9
The girls’ appearance at the Democratic convention will underscore their importance to their father’s image as a likable family man.,"CHARLOTTE, N.C. — On Friday, Malia Obama will be at her desk at Sidwell Friends School for the fourth day of high school — hours after waving onstage at the Democratic National Convention with her sister, Sasha.","{'main': 'Obama Girls’ Role: Not to Speak, but to Be Spoken Of', 'kicker': None, 'content_kicker': None, 'print_headline': 'Unheard, but Speaking Volumes in the Race', 'name': None, 'seo': None, 'sub': None}","Obama Girls’ Role: Not to Speak, but to Be Spoken Of",0.5,0.5,0.08,0.27,0.0,0.0,2012,9
"Former President Bill Clinton drew sharp lines between the choices voters face, using the economic successes in his presidency as a case for re-electing President Obama.","CHARLOTTE, N.C. — Former President Bill Clinton and President Obama hugged onstage Wednesday night after Mr. Clinton delivered an impassioned plea on behalf of Mr. Obama’s re-election, the 42nd president nominating the 44th to a second term with a forceful and spirited argument that Democratic values would restore the promise of the middle class.","{'main': 'Clinton Delivers Impassioned Plea for Obama Second Term', 'kicker': None, 'content_kicker': None, 'print_headline': 'Clinton Delivers Stirring Plea for Obama Second Term', 'name': None, 'seo': None, 'sub': None}",Clinton Delivers Impassioned Plea for Obama Second Term,0.025000000000000005,0.31666666666666665,0.125,0.25,0.0,0.0,2012,9
President Obama’s acceptance speech on Thursday was the cautious declaration of a chastened husband who has been to couples counseling.,"President Obama’s acceptance speech on Thursday wasn’t a sweeping romantic overture, it was the cautious declaration of a chastened husband trying to save a troubled marriage. He doesn’t want to lose the electorate — he’s been to couples counseling, he’s learned to listen, and he knows what to say, and most of all, what not to say.","{'main': '4 Years After Starry Romance, Trying to Save the Marriage', 'kicker': 'The TV Watch', 'content_kicker': None, 'print_headline': '4 Years After Starry Romance, Trying to Save the Marriage', 'name': None, 'seo': None, 'sub': None}","4 Years After Starry Romance, Trying to Save the Marriage",0.0,0.0,0.0,0.6666666666666666,0.0,0.0,2012,9
"Accepting the Democratic nomination for a second term, President Obama argued, “it will take more than a few years for us to solve challenges that have built up over decades.”","CHARLOTTE, N.C. — President Obama accepted the Democratic nomination for a second term on Thursday night, making a forceful argument that he had rescued the economy from disaster and ushered in a recovery that would be imperiled by a return to Republican stewardship.","{'main': 'Obama Makes Case for 2nd Term: ‘Harder’ Path to ‘Better Place’', 'kicker': None, 'content_kicker': None, 'print_headline': 'Obama Makes Case for 2nd Term: ‘Harder’ Path to ‘Better Place’', 'name': None, 'seo': None, 'sub': None}",Obama Makes Case for 2nd Term: ‘Harder’ Path to ‘Better Place’,0.09999999999999999,0.19999999999999998,0.0,0.0,0.13333333333333333,0.16666666666666666,2012,9
"Growing numbers of bears and other animals are descending from mountains and mesas, desperate to eat whatever they can find before winter arrives.",DENVER — People move to the mountains to be closer to nature. But not this close.,"{'main': 'With Their Food Scarce From Drought, More Animals Try Dining in Town', 'kicker': None, 'content_kicker': None, 'print_headline': 'With Their Food Scarce From Drought, More Animals Try Dining in Town', 'name': None, 'seo': None, 'sub': None}","With Their Food Scarce From Drought, More Animals Try Dining in Town",-0.3625,0.6875,0.0,0.0,0.5,0.5,2012,9
"Politically, it is not certain that the report is going to matter that much. The unemployment rate declined for superficial reasons, which makes for a gentler headline for President Obama.",Friday’s jobs report was a weak one — with August’s job growth more in line with the tepid growth of the spring than the stronger numbers in July or over the winter months.,"{'main': 'Effect of Jobs Numbers on Presidential Race Is Uncertain', 'kicker': None, 'content_kicker': None, 'print_headline': None, 'name': None, 'seo': None, 'sub': None}",Effect of Jobs Numbers on Presidential Race Is Uncertain,0.04642857142857144,0.3857142857142857,0.0625,0.5625,0.0,0.0,2012,9
"The convention has offered an early glimpse of some of the party’s ambitious prospects, including Gov. Martin O’Malley of Maryland and Mayor Antonio Villaraigosa of Los Angeles.","CHARLOTTE, N.C. — Whether President Obama wins or loses in November, one thing is certain for Democrats on the morning after Election Day: the 2016 auditions begin.","{'main': 'Looking Past November for a Preview of 2016', 'kicker': 'Political Memo', 'content_kicker': None, 'print_headline': 'Looking Past November for a Preview of 2016', 'name': None, 'seo': None, 'sub': None}",Looking Past November for a Preview of 2016,0.175,0.525,0.07142857142857142,0.2904761904761905,-0.25,0.25,2012,9
At least 25 people have been arrested in protests tied to the Democratic National Convention.,"12:01 a.m. | Updated  CHARLOTTE, N.C. – Five days of marches at the Democratic National Convention brought confrontation and compromise between protesters and the police, and there was a bit of both on Thursday, the final night of the convention.","{'main': 'Protests Continue on Final Night of Democratic Convention', 'kicker': 'The Caucus', 'content_kicker': None, 'print_headline': None, 'name': None, 'seo': None, 'sub': None}",Protests Continue on Final Night of Democratic Convention,-0.3,0.4,0.0,1.0,0.0,1.0,2012,9
"Do voters in a presidential election decide based on an incumbent’s record, or who will do a better job the next four years? A good campaign must be prepared to argue its case under both paradigms.",The two competing models for understanding presidential elections are the referendum paradigm and the choice paradigm. ,"{'main': 'Sept. 6: A Referendum or a Choice?', 'kicker': None, 'content_kicker': None, 'print_headline': None, 'name': None, 'seo': None, 'sub': None}",Sept. 6: A Referendum or a Choice?,0.39999999999999997,0.3666666666666667,0.0,0.0,0.0,0.0,2012,9
"Many of the grass-roots activists, union members and others at the convention acknowledged that the president had fallen short in some areas, but they said he had earned a second term.","CHARLOTTE, N.C. — In a perfect world, Sara Riley, a delegate to the Democratic National Convention from Cedar Rapids, Iowa, would have preferred that President Obama had done more to fulfill what the party saw as the transformative nature of the 2008 campaign and election.","{'main': 'From Convention Floor, Delegates Give Obama Benefit of Their Doubts', 'kicker': None, 'content_kicker': None, 'print_headline': 'From Convention Floor, Delegates Give Obama Benefit of Their Doubts', 'name': None, 'seo': None, 'sub': None}","From Convention Floor, Delegates Give Obama Benefit of Their Doubts",0.16666666666666666,0.26666666666666666,0.75,0.75,0.0,0.0,2012,9
The country once prided itself on a certain sense of equality and optimism. But is the United States still forward-looking?,"NEW YORK — The United States seems so ill at present that no one can agree on what it has. The patient is sprawled out on the table, zonked, and a team of surgeons is bickering over whether the right leg needs to be amputated or already has been.","{'main': 'America Losing Sight of the Future', 'kicker': 'Currents', 'content_kicker': None, 'print_headline': 'America Losing Sight of the Future', 'name': None, 'seo': None, 'sub': None}",America Losing Sight of the Future,0.21428571428571427,0.5714285714285714,-0.019480519480519487,0.49756493506493504,0.0,0.125,2012,9
Todd Akin’s campaign is disputing reports by a Missouri television statement that its ads were pulled because of lack of payment.,"It’s not quite “Mad Men Missouri,” but a little drama is playing out in a dispute between a beleaguered Senate candidate and a television ad department in the state.","{'main': 'Akin Defends Cashflow After Ad Dispute', 'kicker': 'The Caucus', 'content_kicker': None, 'print_headline': 'Ad Run Canceled: Akin’s Finances in Question', 'name': None, 'seo': None, 'sub': None}",Akin Defends Cashflow After Ad Dispute,0.0,0.0,-0.40625,0.75,0.0,0.0,2012,9
"The author, a director of college counseling, shares lessons learned about transitions after her mother joined the Peace Corps.","Marie Bigham is the director of college counseling at Greenhill School in Addison, Tex.","{'main': 'On Going to College, and Saying Goodbye', 'kicker': 'The Choice', 'content_kicker': None, 'print_headline': None, 'name': None, 'seo': None, 'sub': None}","On Going to College, and Saying Goodbye",0.0,0.0,0.0,0.0,0.0,0.0,2012,9
"Our quirky, discerning picks for the most interesting things to do around the state this week.","Our quirky, discerning picks for the most interesting things to do around the state this week.","{'main': 'GTT ★', 'kicker': 'Texas Monthly', 'content_kicker': None, 'print_headline': 'GTT', 'name': None, 'seo': None, 'sub': None}",GTT ★,0.3333333333333333,0.6666666666666666,0.3333333333333333,0.6666666666666666,0.0,0.0,2012,9
"On Sept. 17, 2001, President George W. Bush visited a mosque and spoke eloquently about respect for Islam — an act of leadership that should be celebrated instead of overlooked.","In the coming days, the calendar will bring the anniversaries of two signal events. One, of course, is Sept. 11, a Tuesday this year, as it was in 2001, when Al Qaeda terrorists in four hijacked planes killed more than 3,000 Americans. With public memorial services and private tears, those deaths will be recalled and mourned.","{'main': 'Six Days After 9/11, Another Anniversary Worth Honoring', 'kicker': 'On Religion', 'content_kicker': None, 'print_headline': 'Six Days After 9/11, Another Date Worth Honoring', 'name': None, 'seo': None, 'sub': None}","Six Days After 9/11, Another Anniversary Worth Honoring",0.35,0.75,0.075,0.23541666666666666,0.3,0.1,2012,9
Mitt Romney questioned on Friday whether President Obama “knows what he’s doing” when it comes to fixing the economy.,"SIOUX CITY, Iowa – Seizing on a disappointing jobs report, Mitt Romney questioned on Friday whether President Obama “knows what he’s doing” when it came to fixing the economy.","{'main': 'After a Disappointing Jobs Report, Romney Attacks Obama', 'kicker': 'The Caucus', 'content_kicker': None, 'print_headline': None, 'name': None, 'seo': None, 'sub': None}","After a Disappointing Jobs Report, Romney Attacks Obama",0.0,0.0,-0.6,0.7,-0.6,0.7,2012,9
"Residents outside the ring of levees that protect New Orleans want the federal government to erect walls to protect them, too, especially after Hurricane Isaac caused the river to overflow.","LaPLACE, La. — As the motorcade swept through waterlogged stretches of St. John the Baptist Parish earlier this week, Natalie Robottom, the parish president, made her case to President Obama. Using maps and force of will, she told him that while a new ring of levees had saved New Orleans from the waters of Hurricane Isaac, LaPlace and other communities in St. John, west of the city, were still unprotected despite years of study and discussion.","{'main': 'New Orleans Levees Hold, and Outsiders Want In', 'kicker': None, 'content_kicker': None, 'print_headline': 'As Levees Hold Up, Outsiders Want In', 'name': None, 'seo': None, 'sub': None}","New Orleans Levees Hold, and Outsiders Want In",0.04545454545454545,0.5015151515151515,0.03693181818181818,0.4460227272727273,0.13636363636363635,0.45454545454545453,2012,9
"The ads will run in eight battleground states — Colorado, Florida, Iowa, Nevada, New Hampshire, North Carolina, Ohio and Virginia.","The Romney campaign announced on Friday the beginning of a major advertising campaign in eight battleground states — Colorado, Florida, Iowa, Nevada, New Hampshire, North Carolina, Ohio and Virginia. The effort will include 15 new commercials, each tailored specifically to the state in which it will run and focused on a particular issue, like the deficit, defense, manufacturing and energy.","{'main': 'Romney Team Announces Major Ad Campaign', 'kicker': 'The Caucus', 'content_kicker': None, 'print_headline': None, 'name': None, 'seo': None, 'sub': None}",Romney Team Announces Major Ad Campaign,0.13636363636363635,0.45454545454545453,0.12547348484848483,0.4356060606060606,0.0625,0.5,2012,9
"The debt-adjustment plan will allow downtrodden Central Falls, R.I., to emerge from bankruptcy after a little more than a year.","PROVIDENCE, R.I. — A federal judge paved the way on Thursday for Central Falls, R.I., to emerge from bankruptcy by signing off on a debt-adjustment plan a little more than a year after the downtrodden city entered court protection.","{'main': 'Plan to End Bankruptcy in Rhode Island City Gains Approval', 'kicker': None, 'content_kicker': None, 'print_headline': 'Plan to End Bankruptcy in Rhode Island City Gains Approval', 'name': None, 'seo': None, 'sub': None}",Plan to End Bankruptcy in Rhode Island City Gains Approval,0.10416666666666667,0.4166666666666667,0.10416666666666667,0.4166666666666667,0.0,0.0,2012,9
"His convention speech was only hours old when President Obama, confronted by a dismal new jobs report, found himself having to use precious time on his campaign trail to account for the country’s continued anemic economic recovery.","IOWA CITY — His convention speech was only hours old when President Obama, confronted by a weak new jobs report, found himself Friday having to use precious time on the campaign trail to account for the country’s continued anemic economic recovery.","{'main': 'Jobs Numbers Prompt Obama to Account for Anemic Recovery', 'kicker': 'The Caucus', 'content_kicker': None, 'print_headline': None, 'name': None, 'seo': None, 'sub': None}",Jobs Numbers Prompt Obama to Account for Anemic Recovery,0.18727272727272726,0.5709090909090909,0.09356060606060605,0.5799242424242425,0.0,0.0,2012,9
"Clint Eastwood, in an interview with a local paper, says he came up with his empty chair idea in the green room.","Clint Eastwood said the idea for the most controversial convention speech in a generation came to him in the green room off stage, just after he greeted Archbishop Timothy M. Dolan, the country’s most influential Roman Catholic bishop.","{'main': 'Eastwood Says He Balked at Sharing Speech With Romney Campaign', 'kicker': 'The Caucus', 'content_kicker': None, 'print_headline': 'Eastwood Says Speech Was Entirely Spontaneous', 'name': None, 'seo': None, 'sub': None}",Eastwood Says He Balked at Sharing Speech With Romney Campaign,-0.10000000000000002,0.26666666666666666,0.27,0.47000000000000003,0.0,0.0,2012,9
The authorities will be required to verify the status of people who they suspect are in the country illegally.,"TUCSON — A decision by a federal judge on Wednesday paved the way for the most controversial section of Arizona’s sweeping immigration legislation, requiring the authorities to verify the status of people who they suspect are in the country illegally, to finally take effect. ","{'main': 'Arizona Immigration Law Survives Ruling', 'kicker': None, 'content_kicker': None, 'print_headline': 'Arizona Immigration Law Survives Ruling', 'name': None, 'seo': None, 'sub': None}",Arizona Immigration Law Survives Ruling,-0.5,0.5,0.35000000000000003,0.8166666666666668,0.0,0.0,2012,9
"A closer look at assertions made by President Obama and Vice President Joseph R. Biden Jr. on the economy, energy policy, Medicare and Afghanistan.","President Obama and Vice President Joseph R. Biden Jr. spoke about the economy, energy policy, Medicare and Afghanistan on Thursday night as they accepted their nominations at the Democratic National Convention in Charlotte, N.C. Here is a closer look at some of their assertions:","{'main': 'A Night of Speeches Under a Magnifying Glass', 'kicker': 'Checkpoint', 'content_kicker': None, 'print_headline': 'A Night of Speeches Under a Magnifying Glass', 'name': None, 'seo': None, 'sub': None}",A Night of Speeches Under a Magnifying Glass,0.0,0.0,0.0,0.0,0.0,0.0,2012,9
"When President Obama’s campaign moved his speech to a smaller venue, aides tried to mollify those who could no longer see him with an old, homespun (and cheap) standby: the watch party.",Times are tough for the Obama campaign. It has resorted to commandeering bowling alleys and borrowing restaurants. ,"{'main': 'Obama Reaches Out, Vowing a Rain Check', 'kicker': None, 'content_kicker': None, 'print_headline': 'Obama Reaches Out, Vowing a Rain Check', 'name': None, 'seo': None, 'sub': None}","Obama Reaches Out, Vowing a Rain Check",0.16666666666666666,0.4666666666666666,-0.3888888888888889,0.8333333333333334,0.0,0.0,2012,9
"The Democratic National Convention was without Mr. Gore, one of the party’s biggest stars, who was instead doling out commentary for his network, Current TV.","He came ever so close to capturing the presidency in 2000, and even spoke at the 2008 convention, but this time around, Al Gore was nowhere to be seen as Democrats gathered in Charlotte, N.C., this week.","{'main': 'Al Gore Takes a Pass on Charlotte', 'kicker': 'The Caucus', 'content_kicker': None, 'print_headline': 'For Gore, a Spectacle He’s Seen From Both Sides', 'name': None, 'seo': None, 'sub': None}",Al Gore Takes a Pass on Charlotte,0.0,0.4,0.0,0.0,0.0,0.0,2012,9
"A federal court ruled that the Obama administration was overstepping its authority, and violating the separation of powers in regards to restrictions on lawyers’ access to prisoners at Guantánamo Bay.","WASHINGTON — Accusing the Obama administration of “an illegitimate exercise of executive power,” a federal judge on Thursday rejected the government’s effort to impose new restrictions on lawyers’ access to prisoners at Guantánamo Bay, Cuba, if they were no longer actively challenging the prisoners’ detention in federal court.","{'main': 'Judge Rejects New Rules on Access to Prisoners', 'kicker': None, 'content_kicker': None, 'print_headline': 'Judge Rejects New Rules On Access To Prisoners', 'name': None, 'seo': None, 'sub': None}",Judge Rejects New Rules on Access to Prisoners,0.0,0.0,0.3181818181818182,0.7272727272727273,0.13636363636363635,0.45454545454545453,2012,9
"President Obama and his allies made the case for him as commander in chief and criticized their rivals’ lack of experience, with Mr. Obama saying Mitt Romney was stuck in a “cold war time warp.”","CHARLOTTE, N.C. — President Obama and his allies made the case for him as commander in chief Thursday night, saying he was a steady hand in a dangerous world, while accusing Mitt Romney of outsourcing his policy to “neocon advisers” who would lead a return to the reckless adventurism of the Bush administration.","{'main': 'Obama and Democrats Point to Foreign Policy Strength', 'kicker': None, 'content_kicker': None, 'print_headline': 'Seeking to Make Case for Obama on Strength of His Foreign Policy', 'name': None, 'seo': None, 'sub': None}",Obama and Democrats Point to Foreign Policy Strength,-0.6,1.0,-0.21666666666666667,0.7,-0.125,0.125,2012,9
"Representative Paul D. Ryan, the candidate for vice president, has learned that added scrutiny can turn even marathons and mountains into treacherous topics.","COLORADO SPRINGS — Flying high above the Rocky Mountains on Wednesday, Representative Paul D. Ryan and his brother Tobin jogged their memories to complete a list of the 14,000-foot summits below them that the vice-presidential nominee had climbed. ","{'main': 'For Ryan, Perks of Joining Ticket Can Be Weighty', 'kicker': None, 'content_kicker': None, 'print_headline': 'For Ryan, Perks Of Joining Ticket Can Be Weighty', 'name': None, 'seo': None, 'sub': None}","For Ryan, Perks of Joining Ticket Can Be Weighty",0.0,0.0,0.08666666666666667,0.3466666666666667,0.0,0.0,2012,9
"Allowing executed prisoners to be organ donors could make transplants available to many Texans on the waiting lists, but the prospect is fraught with moral, ethical and medical challenges.","Before Gov. John Kitzhaber of Oregon established a moratorium on his state’s death penalty last year, Christian Longo, a death row inmate, started a campaign to allow the condemned to donate their organs.","{'main': 'Considering Death Row for Organs', 'kicker': 'The Texas Tribune', 'content_kicker': None, 'print_headline': 'Considering Death Row For Organs', 'name': None, 'seo': None, 'sub': None}",Considering Death Row for Organs,0.22000000000000003,0.35,0.0,0.03333333333333333,0.0,0.0,2012,9
"As the campaigns go into high gear, voters can expect a blur of ads and an endless number of unsolicited phone calls.","SIOUX CITY, Iowa — Mitt Romney’s plane touched down here on Friday, and with it arrived the beginning of what is expected to be the most expensive and intense political advertising war ever.","{'main': 'Race Is On in Earnest as Candidates Hit the Road', 'kicker': None, 'content_kicker': None, 'print_headline': 'Race Is On In Earnest As Candidates Hit the Road', 'name': None, 'seo': None, 'sub': None}",Race Is On in Earnest as Candidates Hit the Road,0.0175,0.645,-0.009259259259259254,0.4981481481481482,0.0,0.0,2012,9
"Mitt Romney and his wife, Ann, are to appear on NBC’s “Meet the Press.” Representative Paul D. Ryan will speak for the Republican ticket on CBS’s “Face the Nation” and ABC’s “This Week.”","With the conventions in the rearview mirror, the general election is off and running. The Romney campaign is wasting no time, branching out from the nominee’s almost exclusive appearances on “Fox News Sunday” to date by scheduling Mitt Romney and his wife, Ann, for an interview with NBC’s “Meet the Press.”","{'main': 'Sunday Breakfast Menu, Sept. 9', 'kicker': 'The Caucus', 'content_kicker': None, 'print_headline': None, 'name': None, 'seo': None, 'sub': None}","Sunday Breakfast Menu, Sept. 9",0.0,0.0,0.05000000000000002,0.5,0.0,0.0,2012,9
"So far, eight people out of the thousands who visited the park this summer have been infected with the mouse-borne virus, which has no known cure.","After the death last week of a third person exposed to the deadly mouse-borne hantavirus, public health officials were expanding their warning to include more than 22,000 visitors to Yosemite National Park.","{'main': 'Wider Warning After 3rd Yosemite Hantavirus Death', 'kicker': None, 'content_kicker': None, 'print_headline': 'Wider Warning After 3rd Yosemite Hantavirus Death', 'name': None, 'seo': None, 'sub': None}",Wider Warning After 3rd Yosemite Hantavirus Death,0.1,1.0,0.06,0.20666666666666664,0.0,0.0,2012,9
"There is growing evidence that this year more than ever, the political significance of the extravagant and costly Republican and Democratic conventions was on the decline.","CHARLOTTE, N.C. — The goal of the Democratic convention was to draw a sharp contrast between the visions offered by President Obama and Mitt Romney, promote a first-term record that many Democrats feel Mr. Obama has failed to articulate and persuade nervous Americans to stick with this president through tough times.","{'main': 'Conventions Draw Crowds but Sway Few Voters', 'kicker': 'Political Memo', 'content_kicker': None, 'print_headline': 'Conventions Draw Crowds but Sway Few Voters', 'name': None, 'seo': None, 'sub': None}",Conventions Draw Crowds but Sway Few Voters,0.25,0.3,-0.1284722222222222,0.5958333333333333,-0.2,0.1,2012,9
"Political news from today’s Times and around the Web, plus a look at the president’s weekly address and the latest happenings in Washington.",Today’s Times,"{'main': 'The Weekend Word: It’s Complicated', 'kicker': 'The Caucus', 'content_kicker': None, 'print_headline': None, 'name': None, 'seo': None, 'sub': None}",The Weekend Word: It’s Complicated,0.25,0.5,0.0,0.0,-0.5,1.0,2012,9
