abstract,lead_paragraph,headline,headline_main,abstract_polarity,abstract_subjectivity,lead_paragraph_polarity,lead_paragraph_subjectivity,headline_polarity,headline_subjectivity,year,month
"Two weeks after the pundit class declared the contest all but over for Hillary Rodham Clinton, commentators were once again wearily chewing over a split decision.","David Wright, the ABC News correspondent traveling with Senator Barack Obama in Iowa late Tuesday night, was interpreting the meaning of the senator’s primary performance in Kentucky  where he was “thumped again,” in the words of the ABC “Nightline” anchor Terry Moran.","{'main': 'Pundits, Like Candidates, Find Themselves in Limbo', 'kicker': None, 'content_kicker': None, 'print_headline': None, 'name': None, 'seo': None, 'sub': None}","Pundits, Like Candidates, Find Themselves in Limbo",0.0,0.0,0.05000000000000002,0.55,0.0,0.0,2008,5
"A longtime Cuban-American group allied with Republicans is opening its doors to Democrats, one sign of a trend in changing demographics in Florida.","Much effort has been expended lately looking for signs of change in Cuba, now that an ailing Fidel Castro is no longer chief of state. ","{'main': 'Obama to Address Cuban Group, Marking Shift From G.O.P. Alliances', 'kicker': 'The Caucus', 'content_kicker': None, 'print_headline': None, 'name': None, 'seo': None, 'sub': None}","Obama to Address Cuban Group, Marking Shift From G.O.P. Alliances",0.0,0.0,-0.04999999999999999,0.4,0.0,0.0,2008,5
"The federal appeals court in California reinstated a lawsuit challenging the military’s “don’t ask, don’t tell” policy.","The federal appeals court in California on Wednesday reinstated a lawsuit challenging the military’s “don’t ask, don’t tell” policy, which allows gay men and lesbians to serve in the armed forces so long as their sexual orientation remains private.","{'main': 'Federal Court Reinstates Suit on Gays in Military', 'kicker': None, 'content_kicker': None, 'print_headline': 'Federal Court Reinstates Suit on Gays In Military', 'name': None, 'seo': None, 'sub': None}",Federal Court Reinstates Suit on Gays in Military,0.2,0.55,0.2111111111111111,0.5486111111111112,-0.1,0.1,2008,5
Senator Edward M. Kennedy was greeted by well wishers upon his release after being diagnosed with a brain tumor.,"BOSTON  One day after hearing the news that he has a malignant brain tumor, Senator Edward M. Kennedy, the longtime Massachusetts Democrat and patriarch of the Kennedy family, walked out of a hospital on Wednesday morning to a crowd of well wishers appearing strong and cheerful. ","{'main': 'Kennedy Leaves Hospital in Boston', 'kicker': None, 'content_kicker': None, 'print_headline': None, 'name': None, 'seo': None, 'sub': None}",Kennedy Leaves Hospital in Boston,0.0,0.0,0.4166666666666667,0.8666666666666667,0.0,0.0,2008,5
"Club McCain is open for the weekend in Sedona, Ariz., while Barack Obama and Hillary Clinton could remain running mates throughout the summer.","As The Times first reported yesterday, Club McCain is open for the weekend in Sedona, Ariz., where some of the G.O.P.’s most electable up-and-comers and swingingest-staters get a chance to mingle with the presumptive nominee. ","{'main': 'The Early Word: Let the Veepstakes Begin', 'kicker': 'The Caucus', 'content_kicker': None, 'print_headline': None, 'name': None, 'seo': None, 'sub': None}",The Early Word: Let the Veepstakes Begin,0.0,0.5,0.25,0.4444444444444444,0.1,0.3,2008,5
The campaign releases some medical records from the senator’s last eight years.,"The status of Senator John McCain’s health over the course of the last eight years or so will be a primary topic of discussion today, as some of his medical records have been made available for the media to review. ","{'main': 'McCain’s Health Records', 'kicker': 'The Caucus', 'content_kicker': None, 'print_headline': None, 'name': None, 'seo': None, 'sub': None}",McCain’s Health Records,0.0,0.03333333333333333,0.2,0.24166666666666667,0.0,0.0,2008,5
What the White House was trying to accomplish when it accused NBC News of “deceitful editing.”,"In her column, Sheryl Gay Stolberg writes that the very public dust-up between the White House and NBC over the editing of an interview with President Bush, suggests the White House intends a more combative stance with the media in the twilight of the administration, as attention turns away from Mr. Bush and toward those trying to succeed him. ","{'main': 'A Warning From the White House', 'kicker': 'The Caucus', 'content_kicker': None, 'print_headline': None, 'name': None, 'seo': None, 'sub': None}",A Warning From the White House,0.0,0.0,0.18333333333333335,0.23399999999999999,0.0,0.0,2008,5
Senator Barack Obama said the long policies of isolation have failed to advance the interests of the United States or help people who have suffered under oppressive regimes.,"MIAMI – Senator Barack Obama on Friday called for greater engagement with Cuba and Latin America, saying the long policies of isolation have failed to advance the interests of the United States or help people who have suffered under oppressive regimes.","{'main': 'Obama Discusses Cuba Policy', 'kicker': 'The Caucus', 'content_kicker': None, 'print_headline': None, 'name': None, 'seo': None, 'sub': None}",Obama Discusses Cuba Policy,-0.275,0.35,-0.016666666666666663,0.39999999999999997,0.0,0.0,2008,5
The ruling abruptly threw the largest custody case in recent American history into turmoil.,HOUSTON  A Texas appeals court ruled on Thursday that the state had illegally seized up to 468 children from their homes at a polygamist ranch in West Texas. The decision abruptly threw the largest custody case in recent American history into turmoil.,"{'main': 'Court Says Texas Illegally Seized Sect’s Children', 'kicker': None, 'content_kicker': None, 'print_headline': 'Court Says Texas Illegally Seized Sect’s Children', 'name': None, 'seo': None, 'sub': None}",Court Says Texas Illegally Seized Sect’s Children,-0.041666666666666664,0.4166666666666667,-0.15625,0.4375,-0.5,0.5,2008,5
"Senator Edward M. Kennedy’s stepdaughter, Caroline Raclin, will be among the graduates present as Senator Barack Obama gives the commencement address at Wesleyan University on Sunday.",BOSTON  Senator Edward M. Kennedy will not give the commencement address he was scheduled to deliver on Sunday at Wesleyan University and will be replaced as the speaker by Senator Barack Obama.,"{'main': 'Obama to Fill In for Kennedy at Ceremony', 'kicker': None, 'content_kicker': None, 'print_headline': 'Obama Will Fill In for Kennedy', 'name': None, 'seo': None, 'sub': None}",Obama to Fill In for Kennedy at Ceremony,0.0,0.0,0.0,0.0,0.0,0.0,2008,5
Barack Obama sought to assure Jewish voters in Florida of his commitment to the security of Israel and implored them to disregard rumors about him.,"BOCA RATON, Fla.  Senator Barack Obama sought to assure Jewish voters here on Thursday of his commitment to the security of Israel and implored them to disregard the false stories and rumors about his beliefs, background and foreign policy views toward the Middle East. ","{'main': 'Obama Asks Jewish Voters to Judge Him on His Policies', 'kicker': None, 'content_kicker': None, 'print_headline': 'Obama Asks Jewish Voters to Judge Him on His Policies', 'name': None, 'seo': None, 'sub': None}",Obama Asks Jewish Voters to Judge Him on His Policies,0.0,0.0,-0.13125000000000003,0.18125,0.0,0.0,2008,5
"When Barack Obama criticized John McCain over a bill for veterans’ tuition assistance, the Arizona senator’s response was scathing.","WASHINGTON  Senator John McCain takes pride in his unwavering support for members of the armed forces. So when Senator Barack Obama criticized him on Thursday on the Senate floor, his response was scathing.","{'main': 'Contenders Spar on Veterans’ Bill', 'kicker': None, 'content_kicker': None, 'print_headline': 'Contenders Spar on Veterans’ Bill', 'name': None, 'seo': None, 'sub': None}",Contenders Spar on Veterans’ Bill,-0.6,1.0,-0.6,1.0,0.0,0.0,2008,5
"Senator Barack Obama had not, over the past few days, really capitalized on his accumulation of a majority of pledged delegates.","Senator Barack Obama added three superdelegates to his total today, a boost that comes after he saw just a trickle of delegates go to his side in recent days. Despite Mr. Obama’s triumphant speech in Iowa and the buzz about the vice presidential search, the Senator had not initially capitalized on his performance in Tuesday’s primaries, which gave him a majority of pledged delegates. (He received only two superdelegates on Wednesday and none on Thursday).","{'main': 'Obama Takes 3 More Superdelegates', 'kicker': 'The Caucus', 'content_kicker': None, 'print_headline': None, 'name': None, 'seo': None, 'sub': None}",Obama Takes 3 More Superdelegates,-0.08333333333333333,0.18333333333333335,0.0,0.5,0.5,0.5,2008,5
"The largest fire to burn in the Everglades in 19 years threatened residential areas and destroyed growth, but also benefited the ecosystem.","REDLAND, Fla.  Rick Anderson, the fire management officer for Everglades National Park, stood in the burnt grass where the largest fire in 19 years began here last week and assessed the costs and benefits. ","{'main': 'Everglades Park Counts the Good and the Bad After a Blaze', 'kicker': None, 'content_kicker': None, 'print_headline': 'Everglades Park Counts the Good and the Bad After a Blaze', 'name': None, 'seo': None, 'sub': None}",Everglades Park Counts the Good and the Bad After a Blaze,0.0,0.0,0.0,0.06666666666666667,5.551115123125783e-17,0.6333333333333333,2008,5
She also pointed to the assassination of Robert F. Kennedy — in June 1968 — as evidence that primaries sometimes go on a long time and there was no reason she should give up hers prematurely.,"Updated BRANDON, S.D. –Senator Hillary Rodham Clinton defended staying in the Democratic nominating contests Friday by saying that her husband did not wrap up the nomination until June 1992 and that, “We all remember Bobby Kennedy was assassinated in June in California.”","{'main': 'Clinton, Discussing Nomination Battle, Invokes R.F.K. Assassination', 'kicker': 'The Caucus', 'content_kicker': None, 'print_headline': None, 'name': None, 'seo': None, 'sub': None}","Clinton, Discussing Nomination Battle, Invokes R.F.K. Assassination",-0.05,0.4,0.0,0.0,0.0,0.0,2008,5
"As first lady, Senator Hillary Rodham Clinton spent eight years standing behind a president in the White House, and Bill Clinton is musing that maybe she should do it again — as vice president.","As first lady, Senator Hillary Rodham Clinton spent eight years standing behind a president in the White House. And now, if she can’t get there on her own, former President Bill Clinton is said to be musing, perhaps she ought to do it again – as vice president. Though both campaigns have shrugged off such suggestions, some think the move would help unify the party. And, of course, Senator Barack Obama, assuming he becomes the Democratic nominee, has plenty of other choices.","{'main': 'The Early Word: Veepstakes, Democrat Edition', 'kicker': 'The Caucus', 'content_kicker': None, 'print_headline': None, 'name': None, 'seo': None, 'sub': None}","The Early Word: Veepstakes, Democrat Edition",-0.0625,0.2833333333333333,0.028124999999999997,0.37604166666666666,0.1,0.3,2008,5
"The Democratic candidate circulates a new analysis that projects, if she wins by a big margin in Puerto Rico, her coming out ahead in the popular vote column.","Senator Hillary Clinton is keeping hope alive today with a new assessment of the popular vote that says she is poised to finish the primary season on June 3 as the winner of the overall popular vote, at least by the most inclusive measure, which would include the tallies from all states.","{'main': 'Clinton Touting Popular Vote Projections', 'kicker': 'The Caucus', 'content_kicker': None, 'print_headline': None, 'name': None, 'seo': None, 'sub': None}",Clinton Touting Popular Vote Projections,0.2590909090909091,0.41363636363636364,0.2545454545454545,0.5068181818181818,0.6,0.9,2008,5
Republican leaders gave a tentative nod of approval to three of John McCain’s potential running mates while pointing to other possibilities.,"As Senator John McCain prepared to meet this weekend with three potential running mates, state Republican leaders across the country on Thursday gave a tentative nod of approval to those prospects while pointing to the possible suitability of others and emphasizing that Mr. McCain needed to please the party’s conservative base.","{'main': '3 Auditioning to Be McCain’s No. 2 Gain Qualified Backing', 'kicker': None, 'content_kicker': None, 'print_headline': '3 Auditioning to Be McCain’s No. 2 Gain Qualified Backing', 'name': None, 'seo': None, 'sub': None}",3 Auditioning to Be McCain’s No. 2 Gain Qualified Backing,-0.0625,0.6875,-0.26666666666666666,1.0,0.0,0.0,2008,5
Convention hotel assignments are often read like tea leaves that signal the political fortunes of a particular state and its politicians.,"St. Paul is the host of this year’s Republican convention, and the city will have just a fraction of the hotel rooms that New York City had for the 2004 convention. So many delegates and news people will be staying in the sister city of Minneapolis or in the suburbs, with just a few lucky delegations staying within walking distance of the convention.","{'main': 'Convention Plans: The Power of Location', 'kicker': 'The Caucus', 'content_kicker': None, 'print_headline': None, 'name': None, 'seo': None, 'sub': None}",Convention Plans: The Power of Location,0.08333333333333333,0.21666666666666667,0.19242424242424241,0.47196969696969704,0.0,0.0,2008,5
"As the Democratic candidate outlines a policy toward Latin and Central America, the Republican machine is out in force in its criticism of his ideals.","As Senator Barack Obama speaks to the Cuban American National Foundation today, the Republicans are out in full force over his remarks time and again on whether he would meet with the leaders of rogue nations without preconditions.","{'main': 'Obama and the Preconditions Meme', 'kicker': 'The Caucus', 'content_kicker': None, 'print_headline': None, 'name': None, 'seo': None, 'sub': None}",Obama and the Preconditions Meme,0.0,0.25,0.175,0.275,0.0,0.0,2008,5
"Age and experience become a subtext, once again, in the presidential race.","STOCKTON, Calif.—Now who’s making age an issue?","{'main': 'McCain Judges Obama, That ‘Young Man’', 'kicker': 'The Caucus', 'content_kicker': None, 'print_headline': None, 'name': None, 'seo': None, 'sub': None}","McCain Judges Obama, That ‘Young Man’",0.0,0.0,0.0,0.0,0.1,0.4,2008,5
"So far this term, with 35 cases decided with full opinions, there has been only a single 5-to-4 decision.",WASHINGTON  Where have all the 5-to-4 decisions gone?,"{'main': 'At Supreme Court, 5-to-4 Rulings Fade, but Why?', 'kicker': 'Supreme Court Memo', 'content_kicker': None, 'print_headline': 'In Latest Term, Majority Grows To More Than 5 of the Justices', 'name': None, 'seo': None, 'sub': None}","At Supreme Court, 5-to-4 Rulings Fade, but Why?",0.09464285714285714,0.6910714285714286,0.0,0.0,0.0,0.0,2008,5
John McCain rejected the endorsements of two evangelical ministers who he had hoped would help him court religious conservatives.,Senator John McCain on Thursday rejected the endorsements of two prominent evangelical ministers whose backing he had sought to shore up his credentials with religious conservatives.,"{'main': 'McCain Cuts Ties to Pastors Whose Talks Drew Fire', 'kicker': None, 'content_kicker': None, 'print_headline': 'McCain Cuts Tie to Pastors Whose Talks Drew Fire', 'name': None, 'seo': None, 'sub': None}",McCain Cuts Ties to Pastors Whose Talks Drew Fire,0.0,0.25,0.25,0.625,0.0,0.0,2008,5
Its response to a recent NBC interview suggests the White House intends a more combative stance with the media in the twilight of the administration.," WASHINGTON  Every once in a while, when President Bush or his advisers are particularly exercised by something a reporter writes or a Democrat says, the White House blasts an e-mail to hundreds of Washington opinion-makers under the headline “Setting the Record Straight.”","{'main': 'A Warning From the White House', 'kicker': 'On the White House', 'content_kicker': None, 'print_headline': None, 'name': None, 'seo': None, 'sub': None}",A Warning From the White House,0.16666666666666666,0.25,0.12222222222222223,0.24444444444444446,0.0,0.0,2008,5
"Gov. Sarah Palin’s proposal faces considerable obstacles, both in the State Legislature and the private sector.",Gov. Sarah Palin of Alaska on Thursday proposed granting state subsidies to a Canadian company to build a long-sought natural gas pipeline.,"{'main': 'Alaska Governor Proposes $500 Million in Subsidies for a Gas Pipeline', 'kicker': None, 'content_kicker': None, 'print_headline': 'Alaska Governor Proposes $500 Million in Subsidies for a Gas Pipeline', 'name': None, 'seo': None, 'sub': None}",Alaska Governor Proposes $500 Million in Subsidies for a Gas Pipeline,0.016666666666666666,0.27499999999999997,0.1,0.4,0.0,0.0,2008,5
Friends say that Bill Clinton has spoken of the idea of his wife as Barack Obama’s running mate.,"While Senator Hillary Rodham Clinton and her advisers insist that she is determined to win the Democratic nomination, friends of the couple say that former President Bill Clinton, for one, has begun privately contemplating a different outcome for her: As Senator Barack Obama’s running mate.","{'main': 'As Race Wanes, Talk of Clinton as No. 2 Grows', 'kicker': None, 'content_kicker': None, 'print_headline': 'As Race Runs To the Finish, 2nd Thoughts', 'name': None, 'seo': None, 'sub': None}","As Race Wanes, Talk of Clinton as No. 2 Grows",0.0,0.0,0.2,0.34375,0.0,0.0,2008,5
A military judge on Thursday denied motions to delay the arraignments of five Guantánamo detainees suspected of mounting the Sept. 11 terrorist attacks.,"GUANTÁNAMO BAY NAVAL BASE, Cuba (AP)  A military judge on Thursday denied motions to delay the arraignments of five Guantánamo detainees suspected of mounting the Sept. 11 terrorist attacks.","{'main': 'Guantánamo Judge Won’t Delay Trials', 'kicker': None, 'content_kicker': None, 'print_headline': 'No Delay in Guant&#225;namo Hearing', 'name': None, 'seo': None, 'sub': None}",Guantánamo Judge Won’t Delay Trials,-0.1,0.1,-0.45,0.55,0.0,0.0,2008,5
No Minnesota candidate this fall can afford to ignore the state’s vast universe of Web sites devoted to local politics.,"EAGAN, Minn.  On a laptop at a kitchen table in this cheery Twin Cities suburb, headlines ripping into Al Franken, the satirist whose campaign for the United States Senate is seen as one of the most competitive in the nation, are written up day after day for “Minnesota Democrats Exposed,” a political blog created by a former Republican Party researcher.","{'main': 'Franken-Coleman Race Is Going to the Blogs', 'kicker': None, 'content_kicker': None, 'print_headline': None, 'name': None, 'seo': None, 'sub': None}",Franken-Coleman Race Is Going to the Blogs,0.0,0.5,0.3,0.4,0.0,0.0,2008,5
"John McCain is in excellent health and shows no evidence of a recurrence of the melanoma that led to head and neck surgery in 2000, his doctors said.","SCOTTSDALE, Ariz.  Senator John McCain, 71, is in excellent health and shows no evidence of a recurrence of the melanoma skin cancer that led to extensive head and neck surgery in 2000, Mr. McCain’s doctors said on Friday.","{'main': 'Doctors Say McCain Is in Robust Health and Free of Cancer', 'kicker': None, 'content_kicker': None, 'print_headline': None, 'name': None, 'seo': None, 'sub': None}",Doctors Say McCain Is in Robust Health and Free of Cancer,1.0,1.0,0.5,0.6666666666666666,0.4,0.8,2008,5
"Immigrants arrested in an Iowa raid faced tough criminal charges instead of rapid deportation, signaling a sharp escalation in a Bush administration crackdown.","WATERLOO, Iowa  In temporary courtrooms at a fairgrounds here, 260 illegal immigrants were sentenced this week to five months in prison for working at a meatpacking plant with false documents. ","{'main': '270 Illegal Immigrants Sent to Prison in Federal Push', 'kicker': None, 'content_kicker': None, 'print_headline': '270 IMMIGRANTS SENT TO PRISON IN FEDERAL PUSH', 'name': None, 'seo': None, 'sub': None}",270 Illegal Immigrants Sent to Prison in Federal Push,-0.30462962962962964,0.7111111111111111,-0.45000000000000007,0.55,-0.5,0.5,2008,5
Only a small group of chosen reporters were allowed to view Senator John McCain’s medical records for a limited period of time.,"WASHINGTON  Senator John McCain released his medical records on Friday under tightly controlled circumstances, allowing them to be reviewed by a small group of reporters from news organizations that his campaign chose.","{'main': 'Tight Control on McCain Files and Shortened Question Period', 'kicker': None, 'content_kicker': None, 'print_headline': 'Tight Control on Files and Shortened Question Period', 'name': None, 'seo': None, 'sub': None}",Tight Control on McCain Files and Shortened Question Period,-0.08035714285714285,0.3857142857142857,-0.14285714285714288,0.22857142857142856,-0.17857142857142858,0.2857142857142857,2008,5
Senator John McCain’s wife abruptly reversed course and released a summary of her 2006 income tax return after weeks of vowing not to do so.,"Senator John McCain’s wife, Cindy, abruptly reversed course on Friday and released a summary of her 2006 income tax return after weeks of vowing not to do so. The form revealed that she took in more than $6 million in taxable income that year.","{'main': 'Cindy McCain Releases Summary of Taxes', 'kicker': None, 'content_kicker': None, 'print_headline': 'Cindy McCain Releases Summary of Taxes', 'name': None, 'seo': None, 'sub': None}",Cindy McCain Releases Summary of Taxes,-0.125,1.0,0.1875,0.75,0.0,0.0,2008,5
A poll has found that more than half of Californians support a proposed ballot measure that would overturn a recent ruling that legalized same-sex marriage.,"SAN FRANCISCO  More than half of Californians support a proposed ballot measure that would overturn a recent ruling that legalized same-sex marriage in the state, a poll has found. ","{'main': 'A Poll Finds Californians Still Oppose Gay Marriage', 'kicker': None, 'content_kicker': None, 'print_headline': 'A Poll Finds Californians Still Oppose Gay Marriage', 'name': None, 'seo': None, 'sub': None}",A Poll Finds Californians Still Oppose Gay Marriage,0.11111111111111112,0.3055555555555555,0.11111111111111112,0.3055555555555555,0.4166666666666667,0.5833333333333334,2008,5
"You can learn a lot about the state of a campaign from its rope lines, and about the style of the person running.","GRAND RAPIDS, Mich.  The man was persistent in demanding Senator Barack Obama’s tie. ","{'main': 'Where to Catch the Sights, Sound and Smell of a Campaign', 'kicker': None, 'content_kicker': None, 'print_headline': 'Where to Catch the Sights, Sound and Smell of a Campaign', 'name': None, 'seo': None, 'sub': None}","Where to Catch the Sights, Sound and Smell of a Campaign",0.0,0.0,0.5,1.0,0.4,0.4,2008,5
"While you’re priming the grill for Memorial Day festivities, Sunday’s talk shows will be dominated by figures who are, at this point, fairly accustomed to the hosts’ grilling.","While you’re priming the grill for Memorial Day festivities, Sunday’s talk shows will be dominated by figures who are, at this point, fairly accustomed to the hosts’ grilling.","{'main': 'Sunday’s Breakfast Menu, May 25', 'kicker': 'The Caucus', 'content_kicker': None, 'print_headline': None, 'name': None, 'seo': None, 'sub': None}","Sunday’s Breakfast Menu, May 25",0.7,0.9,0.7,0.9,0.0,0.0,2008,5
"John McCain is in excellent health and shows no evidence of a recurrence of the melanoma that led to head and neck surgery in 2000, his doctors said.","SCOTTSDALE, Ariz.  Senator John McCain, 71, is in excellent health and shows no evidence of the recurrence of the melanoma skin cancer that led to extensive head and neck surgery in 2000, Mr. McCain’s doctors said Friday.","{'main': 'McCain’s Health Is Called Robust by His Doctors', 'kicker': None, 'content_kicker': None, 'print_headline': 'McCain’s Health Is Called Robust By His Doctors', 'name': None, 'seo': None, 'sub': None}",McCain’s Health Is Called Robust by His Doctors,1.0,1.0,0.5,0.6666666666666666,0.0,0.0,2008,5
"In a campaign whose one-thing-after-another nature rivals that of any National Lampoon movie, the latest twist seems to have shocked even some of the most jaded observers.","In a campaign whose one-thing-after-another nature rivals that of any National Lampoon movie, the latest twist seems to have shocked even some of the most jaded observers. ","{'main': 'The Early Word: R.F.K. Fallout', 'kicker': 'The Caucus', 'content_kicker': None, 'print_headline': None, 'name': None, 'seo': None, 'sub': None}",The Early Word: R.F.K. Fallout,0.10000000000000002,0.7333333333333334,0.10000000000000002,0.7333333333333334,0.1,0.3,2008,5
The Democratic candidate spends time in San Juan before the primary on June 1.,"SAN JUAN, P.R. – The beats of salsa and reggaeton were pulsing, the sun was shining and the waves of the Atlantic were rippling in the distance when Senator Barack Obama walked into La Plaza del Quinto to greet supporters one week before the Democratic presidential primary here.","{'main': 'Obama Campaigns in Puerto Rico', 'kicker': 'The Caucus', 'content_kicker': None, 'print_headline': None, 'name': None, 'seo': None, 'sub': None}",Obama Campaigns in Puerto Rico,0.4,0.5,0.4,0.5,0.0,0.0,2008,5
