abstract,lead_paragraph,headline,headline_main,abstract_polarity,abstract_subjectivity,lead_paragraph_polarity,lead_paragraph_subjectivity,headline_polarity,headline_subjectivity,year,month
"Bostonians received assurance that danger is past, but the investigation continued, with officials struggling to learn whether the two suspects had help or operated alone.","MEDFORD, Mass. — Boston began to say goodbye on Sunday to those it lost last week. Its leaders — religious as well as political — fanned out, in front of naves and cameras, to do what they could to reassure grieving parishioners and constituents that the danger had passed. Or that for those who are gone, “life,” as Cardinal Sean P. O’Malley put it, “is not ended, merely changed.”","{'main': 'Boston Begins to Say Goodbye to Victims of the Bombings', 'kicker': None, 'content_kicker': None, 'print_headline': 'Bostonians, Assured That Danger Is Past, Begin Farewells to Victims', 'name': None, 'seo': None, 'sub': None}",Boston Begins to Say Goodbye to Victims of the Bombings,-0.25,0.25,-0.125,0.22916666666666666,0.0,0.0,2013,4
"Several senators want the ability to question the suspect at length without any lawyer, intensifying a recurring debate over how to handle terrorism cases arising inside the United States.","WASHINGTON — Some Republican lawmakers want President Obama to declare the surviving Boston bombing suspect an enemy combatant in order to question him without a lawyer and other protections of the criminal justice system, intensifying a recurring debate over how to handle terrorism cases arising inside the United States.","{'main': 'G.O.P. Lawmakers Push to Have Boston Suspect Questioned as Enemy Combatant', 'kicker': None, 'content_kicker': None, 'print_headline': 'G.O.P. Lawmakers Push to Have Boston Suspect Questioned as Enemy Combatant', 'name': None, 'seo': None, 'sub': None}",G.O.P. Lawmakers Push to Have Boston Suspect Questioned as Enemy Combatant,0.0,0.0,-0.2625,0.4625,0.0,0.0,2013,4
Department of Homeland Security officials had decided not to grant an application for American citizenship by Tamerlan Tsarnaev after a routine background check revealed that he had been interviewed by the F.B.I.,"Department of Homeland Security officials decided in recent months not to grant an application for American citizenship by Tamerlan Tsarnaev, one of two brothers suspected in the Boston Marathon bombings, after a routine background check revealed that he had been interviewed in 2011 by the F.B.I., federal officials said on Saturday. ","{'main': 'F.B.I. Interview Led Homeland Security to Hold Up Citizenship for One Brother', 'kicker': None, 'content_kicker': None, 'print_headline': 'F.B.I. Interview Led Homeland Security to Hold Up Citizenship for One Brother', 'name': None, 'seo': None, 'sub': None}",F.B.I. Interview Led Homeland Security to Hold Up Citizenship for One Brother,0.0,0.0,0.0,0.125,0.0,0.0,2013,4
"At least in part, the bombers’ intent was to disrupt exactly what events like the Boston Marathon celebrate: the American given, as found along a 26.2-mile stretch of Massachusetts pavement.","HOPKINTON, Mass.","{'main': 'Along the Route, Main Streets, Hills and a New Kind of Heartbreak', 'kicker': 'This Land', 'content_kicker': None, 'print_headline': 'Along the Route, Main Streets, Hills and a New Kind of Heartbreak', 'name': None, 'seo': None, 'sub': None}","Along the Route, Main Streets, Hills and a New Kind of Heartbreak",-0.016666666666666663,0.21666666666666667,0.0,0.0,0.301010101010101,0.5626262626262627,2013,4
President Obama will attend a memorial service this week for victims of the fertilizer plant explosion in Texas in what will be his latest foray as the country’s comforter in chief.,"President Obama will attend a memorial service this week for the victims of the fertilizer plant explosion in West, Tex., in what will be his latest foray as the country’s comforter in chief.","{'main': 'Obama to Attend Memorial Service for Victims of Texas Blast', 'kicker': 'The Caucus', 'content_kicker': None, 'print_headline': None, 'name': None, 'seo': None, 'sub': None}",Obama to Attend Memorial Service for Victims of Texas Blast,0.5,0.9,0.5,0.9,0.0,0.0,2013,4
The mayor is championing a new stadium as an engine for construction jobs and a way to transform an impoverished section of downtown.,"ATLANTA — Football, God and rebuilding are among the most enduring themes here in the largest city in the Deep South.","{'main': 'In Atlanta, Two Churches Lie in New Stadium’s Path', 'kicker': None, 'content_kicker': None, 'print_headline': 'In Atlanta, Two Churches Lie In New Stadium’s Path', 'name': None, 'seo': None, 'sub': None}","In Atlanta, Two Churches Lie in New Stadium’s Path",0.13636363636363635,0.45454545454545453,0.25,0.45,0.13636363636363635,0.45454545454545453,2013,4
"The surviving suspect in the marathon bombings, who officials said admitted to a role in the attacks, was charged with using a weapon of mass destruction.","BOSTON — Lying grievously wounded in a hospital bed, the surviving suspect in the Boston Marathon bombings admitted on Sunday to playing a role in the attacks, said law enforcement officials, and on Monday he was charged with using a weapon of mass destruction that resulted in three deaths and more than 170 injuries.","{'main': 'Boston Suspect Is Charged and Could Face the Death Penalty', 'kicker': None, 'content_kicker': None, 'print_headline': 'Surviving Suspect is Charged by U.S. in Boston Attack', 'name': None, 'seo': None, 'sub': None}",Boston Suspect Is Charged and Could Face the Death Penalty,0.0,0.0,-0.15000000000000002,0.75,0.0,0.0,2013,4
"The dispute at the Flathead Reservation centers on a proposed bill that would specify who is entitled to the water, and how much they can take from the reservoirs and ditches.","RONAN, Mont. — In a place where the lives and histories of Indian tribes and white settlers intertwine like mingling mountain streams, a bitter battle has erupted on this land over the rivers running through it.","{'main': 'Water Rights Tear at an Indian Reservation', 'kicker': None, 'content_kicker': None, 'print_headline': 'Water Rights Tear at an Indian Reservation', 'name': None, 'seo': None, 'sub': None}",Water Rights Tear at an Indian Reservation,0.2,0.2,-0.05,0.25,0.0,0.0,2013,4
Senator Charles E. Schumer said fellow senators were pointing to the Boston attack as “an excuse for not doing a bill or delaying it many months or years.”,"WASHINGTON — After months of heated negotiations, a bipartisan group of eight senators finally achieved compromise, coming together to unveil a broad overhaul of the nation’s immigration laws. But at a Senate Judiciary Committee hearing on the legislation Monday, a new set of divisions began to emerge, offering an early glimpse at the partisan politics likely to be on display as the immigration bill winds its way through the Senate.","{'main': 'Heated Questions and Divisions Emerge at Immigration Bill Hearing', 'kicker': None, 'content_kicker': None, 'print_headline': 'Heated Questions and Divisions Emerge at Immigration Bill Hearing', 'name': None, 'seo': None, 'sub': None}",Heated Questions and Divisions Emerge at Immigration Bill Hearing,0.225,0.275,0.05977272727272727,0.6134090909090909,0.0,0.0,2013,4
"Pilots, gate agents and others blamed budget cuts, but the F.A.A. said it was too soon to assign blame for delays of up to two hours.","WASHINGTON — Flights were delayed by up to two hours across the country on Monday, the first weekday that the nation’s air traffic control system operated with 10 percent fewer controllers. Pilots, gate agents and others were quick to blame furloughs caused by mandatory across-the-board budget cuts, but the Federal Aviation Administration said it was too soon to tell.","{'main': 'Flights Delayed Across Country Amid Budget-Cut Furloughs of Air Controllers', 'kicker': None, 'content_kicker': None, 'print_headline': 'Flights Delayed Across Country Amid Budget-Cut Furloughs of Air Controllers', 'name': None, 'seo': None, 'sub': None}",Flights Delayed Across Country Amid Budget-Cut Furloughs of Air Controllers,0.0,0.0,0.22777777777777775,0.5777777777777778,0.0,0.0,2013,4
"Natural intelligence is not a substitute for hard work, and hard work should not be devalued when combined with tutoring, mentoring or any of the other skill-building services at your disposal.","Lionel Anderson is the assistant director of the office of academic resources at Haverford College and an active board member of TeenSHARP, a nonprofit college preparatory program.","{'main': 'Advice for Smart Students on Succeeding in College', 'kicker': 'The Choice', 'content_kicker': None, 'print_headline': None, 'name': None, 'seo': None, 'sub': None}",Advice for Smart Students on Succeeding in College,-0.15208333333333335,0.46458333333333335,-0.06666666666666667,0.3,0.21428571428571427,0.6428571428571429,2013,4
Representative Paul D. Ryan rejected suggestions by some Republicans that last week’s bombings should stall immigration talks and backed a plan that would increase border protection and create a path to legal status for immigrants here illegally.,"CHICAGO — Representative Paul D. Ryan, Republican of Wisconsin, said on Monday that he did not believe the Boston Marathon bombings should prevent immigration overhaul talks from moving forward in Washington. ","{'main': 'Boston Attack Shows Need for Immigration Overhaul, Ryan Says', 'kicker': 'The Caucus', 'content_kicker': None, 'print_headline': None, 'name': None, 'seo': None, 'sub': None}","Boston Attack Shows Need for Immigration Overhaul, Ryan Says",-0.09999999999999999,0.25555555555555554,0.0,0.0,0.0,0.0,2013,4
"At the White House Science Fair on Monday, President Obama announced a plan to encourage the study of science, technology, engineering and math.","Praising the work of young scientists and inventors at the third White House Science Fair, President Obama on Monday announced a broad plan to create and expand federal and private-sector initiatives designed to encourage children to study science, technology, engineering and mathematics.","{'main': 'A Presidential Pat for Young Scientists', 'kicker': None, 'content_kicker': None, 'print_headline': 'A Presidential Pat For Young Scientists', 'name': None, 'seo': None, 'sub': None}",A Presidential Pat for Young Scientists,0.35,0.45,0.1725,0.3225,0.1,0.4,2013,4
The authorities have grown increasingly certain that the two men suspected in the Boston Marathon bombings acted alone and were most likely planning to put a small arsenal to use in additional attacks.,"WASHINGTON — The two men suspected in the Boston Marathon bombings were armed with a small arsenal of guns, ammunition and explosives when they first confronted the police early Friday, and were most likely planning more attacks, the authorities said Sunday.","{'main': 'Investigators Dig for Roots of Bomb Suspects’ Radicalization', 'kicker': None, 'content_kicker': None, 'print_headline': 'Suspects Seemed Set for Attacks Beyond Boston', 'name': None, 'seo': None, 'sub': None}",Investigators Dig for Roots of Bomb Suspects’ Radicalization,0.11607142857142858,0.6178571428571428,0.18333333333333335,0.5055555555555555,0.0,0.0,2013,4
"Public opinion surveys conducted since the marathon bombings in Boston indicate that most Americans don’t feel personally threatened by terrorism, and an increasing share of the public is skeptical about sacrificing personal freedoms for security.","Public opinion surveys conducted since the bombings last week at the Boston Marathon indicate that most Americans — while convinced future attacks are quite likely — don’t feel personally threatened by terrorism, and an increasing share of the public is skeptical about sacrificing personal freedoms for security. ","{'main': 'Polls Show Growing Resolve to Live With Terror Threat', 'kicker': 'FiveThirtyEight', 'content_kicker': None, 'print_headline': None, 'name': None, 'seo': None, 'sub': None}",Polls Show Growing Resolve to Live With Terror Threat,0.0,0.2888888888888889,0.0,0.32499999999999996,0.13636363636363635,0.5,2013,4
"Many of the people wounded in the Boston bombings could face staggering bills for care and rehabilitation, and compensation fund administrators must decide what to cover.","WASHINGTON — For victims of the Boston Marathon bombings, the terrible physical cost may come with a daunting financial cost as well. ","{'main': 'For Wounded, Daunting Cost; for Aid Fund, Tough Decisions', 'kicker': None, 'content_kicker': None, 'print_headline': 'For Wounded, Daunting Cost; For Aid Fund, Tough Decisions', 'name': None, 'seo': None, 'sub': None}","For Wounded, Daunting Cost; for Aid Fund, Tough Decisions",0.5,0.5,-0.3333333333333333,0.38095238095238093,-0.3888888888888889,0.8333333333333334,2013,4
"With many air traffic controllers on unpaid leave, lawmakers criticized the agency for how it was handling the automatic budget cuts required by sequestration.","WASHINGTON — The furlough of air traffic controllers delayed more than 1,200 flights on Monday, the first weekday of the unpaid leaves, the Federal Aviation Administration said Tuesday as lawmakers criticized the agency for how it was handling the automatic budget cuts.","{'main': 'F.A.A. Says Furloughs Delayed 1,200 Flights', 'kicker': None, 'content_kicker': None, 'print_headline': 'F.A.A. Says Furloughs Delayed 1,200 Flights', 'name': None, 'seo': None, 'sub': None}","F.A.A. Says Furloughs Delayed 1,200 Flights",0.35,0.45,0.31666666666666665,0.41111111111111115,0.0,0.0,2013,4
"The Twitter account for The Associated Press was hacked on Tuesday and erroneously sent out a tweet saying there had been explosions at the White House, injuring President Obama.",Hackers hijacked the Twitter account for The Associated Press on Tuesday and sent out an erroneous message reporting explosions at the White House that injured President Obama.,"{'main': 'In Hacking, A.P. Twitter Feed Sends False Report of Explosions', 'kicker': 'The Caucus', 'content_kicker': None, 'print_headline': 'In Hacking, A.P. Twitter Feed Sends False Report of Explosions ', 'name': None, 'seo': None, 'sub': None}","In Hacking, A.P. Twitter Feed Sends False Report of Explosions",-0.25,0.3,-0.25,0.3,-0.4000000000000001,0.6,2013,4
The former chief of staff for the presidential campaign of Representative Michele Bachmann said in an affidavit released on Monday that the campaign made payments to an Iowa state senator to work on the campaign and that Ms. Bachmann supported the arrangement.,"The former chief of staff for the presidential campaign of Representative Michele Bachmann, Republican of Minnesota, released an affidavit on Monday describing how Ms. Bachmann’s campaign allegedly made payments to an Iowa state senator to work on the campaign.","{'main': 'Campaign Aide Says Bachmann Knew of Payments to State Senator', 'kicker': 'The Caucus', 'content_kicker': None, 'print_headline': None, 'name': None, 'seo': None, 'sub': None}",Campaign Aide Says Bachmann Knew of Payments to State Senator,0.0,0.0,-0.05,0.05,0.0,0.0,2013,4
"The state flower’s brief blooming period is also trespassing season, as crowds tramp through privately owned farms and ranches for the perfect photo.","CHAPPELL HILL, Tex. — It is bluebonnet season in Texas, when hayfields and grazing pastures are transformed into seas of indigo bloom. And while Vermonters take pride in their fall foliage and Washingtonians love their cherry blossoms, Texans can be near fanatical about bluebonnets, sometimes ignoring property laws and personal safety to wade into their fragrant midst.","{'main': 'Breaking Laws and Fighting Fire Ants in a Rush to the Texas Bluebonnet Fields', 'kicker': None, 'content_kicker': None, 'print_headline': 'Breaking Laws and Fighting Fire Ants in a Rush to the Texas Bluebonnet Fields', 'name': None, 'seo': None, 'sub': None}",Breaking Laws and Fighting Fire Ants in a Rush to the Texas Bluebonnet Fields,0.3333333333333333,0.5694444444444444,0.19999999999999998,0.43333333333333335,0.0,0.0,2013,4
"Federal authorities invoked a public safety exemption to standard criminal procedures and questioned Dzhokhar Tsarnaev without telling him he had the right to remain silent, according to a senior American official.","A senior United States official said Monday that federal authorities invoked a public safety exemption to standard criminal procedures and questioned Dzhokhar Tsarnaev on Sunday without telling him that he had the right to remain silent, in order to learn whether he knew of remaining active threats. ","{'main': 'In Questions at First, No Miranda for Suspect', 'kicker': None, 'content_kicker': None, 'print_headline': 'In Questions At First, No Miranda For Suspect', 'name': None, 'seo': None, 'sub': None}","In Questions at First, No Miranda for Suspect",-0.019047619047619053,0.20873015873015874,-0.041269841269841276,0.30873015873015874,0.25,0.3333333333333333,2013,4
The Supreme Court heard arguments about whether groups receiving federal money to combat AIDS abroad may be required to adopt policies opposing prostitution.,"WASHINGTON — The question for the Supreme Court on Monday was whether groups receiving federal money to combat AIDS abroad may be required to adopt policies opposing prostitution. The answer, judging from the justices’ comments in the first half of the argument, seemed to be that the First Amendment bars attaching that kind of condition to federal grants.","{'main': 'Justices Weigh Conditions in Awarding U.S. Grants', 'kicker': None, 'content_kicker': None, 'print_headline': 'Justices Weigh Conditions In Awarding U.S. Grants', 'name': None, 'seo': None, 'sub': None}",Justices Weigh Conditions in Awarding U.S. Grants,0.0,0.0,0.23333333333333334,0.43333333333333335,0.0,0.0,2013,4
"The White House defended President Obama’s efforts on gun violence, but he has long struggled to master his relationship with Congress.","WASHINGTON — Senator Mark Begich, Democrat of Alaska, asked President Obama’s administration for a little favor last month. Send your new interior secretary this spring to discuss a long-simmering dispute over construction of a road through a wildlife refuge, Mr. Begich asked in a letter. The administration said yes.","{'main': 'In Gun Bill Defeat, a President’s Distaste for Twisting Arms', 'kicker': None, 'content_kicker': None, 'print_headline': 'In Gun Bill Defeat, a President Who Hesitates to Twist Arms', 'name': None, 'seo': None, 'sub': None}","In Gun Bill Defeat, a President’s Distaste for Twisting Arms",-0.025,0.2,-0.017045454545454548,0.34040404040404043,0.0,0.0,2013,4
"Sush Krishnamoorthy, a student at Sardar Patel Vidyalaya in New Delhi, has decided to attend Cornell University this fall because of its financial aid package and computer science program.","After receiving a dream acceptance, I have chosen to enroll at Cornell University. It offered me an excellent financial aid package and has a highly reputed computer science department.","{'main': 'Leaving India for the Ivy League', 'kicker': 'The Choice', 'content_kicker': None, 'print_headline': None, 'name': None, 'seo': None, 'sub': None}",Leaving India for the Ivy League,0.06818181818181818,0.22727272727272727,0.38666666666666666,0.5133333333333333,0.0,0.0,2013,4
Senior officials will have to explain to a Senate panel their actions before and after Tamerlan Tsarnaev’s six-month trip last year to Chechnya and Dagestan.,"WASHINGTON — Amid questions about whether the F.B.I. missed an opportunity to discover that one of the suspects in the Boston Marathon bombings may have become an extremist, law enforcement officials defended their actions on Monday, saying they had no legal basis to monitor him in the months leading up to the attack. ","{'main': 'Officials Say They Had No Authority to Watch Older Suspect', 'kicker': None, 'content_kicker': None, 'print_headline': 'Officials Say They Didn’t Have Authority to Monitor Suspect', 'name': None, 'seo': None, 'sub': None}",Officials Say They Had No Authority to Watch Older Suspect,0.0,0.06666666666666667,-0.1,0.2,0.16666666666666666,0.3333333333333333,2013,4
"The informal caucus of women in the Senate – now a record 20 strong – will take its monthly bipartisan dinner tradition on Tuesday night to the White House, where they will meet with President Obama to discuss budget issues and other legislative matters.","The informal caucus of women in the Senate — now a record 20 strong — will take its monthly bipartisan dinner tradition on Tuesday night to the White House, where they will meet with President Obama to discuss budget issues and other legislative matters. ","{'main': 'Women of the Senate Are Obama’s Latest Dinner Guests', 'kicker': 'The Caucus', 'content_kicker': None, 'print_headline': None, 'name': None, 'seo': None, 'sub': None}",Women of the Senate Are Obama’s Latest Dinner Guests,0.10277777777777779,0.36944444444444446,0.10277777777777779,0.36944444444444446,0.5,0.9,2013,4
"The judge granted motions for acquittal for three of seven murder charges against Dr. Kermit Gosnell, who has been charged with killing viable fetuses while performing abortions.",PHILADELPHIA — A Pennsylvania judge on Tuesday threw out three of seven murder charges against a Philadelphia doctor charged with killing viable fetuses while performing abortions.,"{'main': 'Philadelphia Abortion Doctor Is Cleared on Some Counts', 'kicker': None, 'content_kicker': None, 'print_headline': 'Philadelphia Abortion Doctor Is Cleared on Some Counts', 'name': None, 'seo': None, 'sub': None}",Philadelphia Abortion Doctor Is Cleared on Some Counts,0.0,0.0,0.0,0.0,0.0,0.0,2013,4
Investigators’ early portrait of the two brothers accused in the marathon bombings suggests they were driven by extremist Islamic beliefs and may have learned to build bombs on the Web.,"The portrait investigators have begun to piece together of the two brothers suspected of the Boston Marathon bombings suggests that they were motivated by extremist Islamic beliefs but were not acting with known terrorist groups — and that they may have learned to build bombs simply by logging onto the online English-language magazine of the affiliate of Al Qaeda in Yemen, law enforcement officials said Tuesday.","{'main': 'Boston Suspects Are Seen as Self-Taught and Fueled by Web', 'kicker': None, 'content_kicker': None, 'print_headline': 'Boston Suspects Are Seen as Zealots, and Self-Taught', 'name': None, 'seo': None, 'sub': None}",Boston Suspects Are Seen as Self-Taught and Fueled by Web,0.1,0.3,0.0,0.17857142857142858,0.0,0.0,2013,4
"“The social sharing of a small amount of marijuana” for no payment does not require automatic deportation, a seven-justice majority found.","WASHINGTON — “The social sharing of a small amount of marijuana” by immigrants lawfully in the United States does not require their automatic deportation, the Supreme Court ruled on Tuesday.","{'main': 'Court Rules for Immigrant on Deportation in Drug Case ', 'kicker': None, 'content_kicker': None, 'print_headline': 'Court Rules for Immigrant on Deportation in Drug Case', 'name': None, 'seo': None, 'sub': None}",Court Rules for Immigrant on Deportation in Drug Case ,-0.10833333333333334,0.23333333333333334,-0.07222222222222223,0.15555555555555556,0.0,0.0,2013,4
"Political news from today’s Times and around the Web, plus a look at the latest happenings in Washington.",Today’s Times,"{'main': 'The Early Word: Lost in Translation', 'kicker': 'The Caucus', 'content_kicker': None, 'print_headline': None, 'name': None, 'seo': None, 'sub': None}",The Early Word: Lost in Translation,0.25,0.5,0.0,0.0,0.1,0.3,2013,4
"The service for a 29-year-old woman killed in the bombings drew an overflow crowd, and members of the Boston University community gathered to remember a 23-year-old graduate student from China.","MEDFORD, Mass. — With the horror of the Boston Marathon bombings a week in the past, two communities carved out space for quiet remembrance on Monday, bidding farewell to Krystle Campbell and Lu Lingzi, the two young women claimed by the blasts at the race’s finish line. ","{'main': 'Hundreds Gather at Services Held for Marathon Victims', 'kicker': None, 'content_kicker': None, 'print_headline': 'Hundreds Gather at Services Held for Marathon Victims', 'name': None, 'seo': None, 'sub': None}",Hundreds Gather at Services Held for Marathon Victims,-0.2,0.0,-0.049999999999999996,0.3277777777777778,0.0,0.0,2013,4
"The homeland security secretary, Janet Napolitano, cited increased financing and manpower and a mandatory electronic employment verification system.","WASHINGTON — Legislation to overhaul the nation’s immigration laws would further strengthen the country’s security system to guard against cases like the Boston Marathon bombings, Homeland Security Secretary Janet Napolitano told the Senate Judiciary Committee on Tuesday in the last of three hearings on a bipartisan immigration proposal.","{'main': 'Immigration Bill Would Aid Security, Napolitano Says', 'kicker': None, 'content_kicker': None, 'print_headline': 'Immigration Bill Would Aid Security, Napolitano Says', 'name': None, 'seo': None, 'sub': None}","Immigration Bill Would Aid Security, Napolitano Says",0.0,0.0,0.0,0.2833333333333333,0.0,0.0,2013,4
